indic_id,chapter,page,paragraph
AR6_WG1_8_29,8,45,"Since AR5, there has been improved understanding of changes in the South American monsoon (SAmerM) as evidenced from paleoclimate records, instrumental observations and climate model simulations. However, general circulation models (GCMs) still exhibit difficulties in reproducing SAmerM precipitation amount (Rojas et al., 2016; D’Agostino et al., 2020b). Paleoclimate evidence suggests a relatively stronger SAmerM during the 1400–1600 period (Bird et al., 2011b; Vuille et al., 2012; Ledru et al., 2013; Apaéstegui et al., 2014; Novello et al., 2016; Wortham et al., 2017). Last millennium GCM simulations are able to reproduce stronger SAmerM during the 1400–1600 period in comparison with warmer epochs such as the 900–1100 period (Rojas et al., 2016) or the current warming period (Díaz and Vera, 2018). PMIP3/CMIP5 simulations INDICate a consistent weaker SAmerM during the mid-Holocene (6000 years ago; see Cross- Chapter Box 2.1) in comparison to current conditions (Bird et al., 2011a; Mollier-Vogel et al., 2013; Prado et al., 2013a; D’Agostino et al., 2020b), thus favouring savannah/grassland-like vegetation (Smith and Mayle, 2018), in agreement with climate reconstructions from different proxies (Prado et al., 2013b). Signals of weak and strong SAmerM during mid-Holocene and LGM, respectively, are evident also in high-resolution long-term (i.e., more than about 22,000 years) rainfall reconstructions based on oxygen isotopes in speleothems from Brazil (Novello et al., 2017; Stríkis et al., 2018; Campos et al., 2019)."
AR6_WG1_8_30,8,45,"Observations during 1979 2014 suggest that poleward shifts in the South Atlantic Convergence Zone (SACZ) noted in recent decades (Talento and Barreiro, 2018; Zilli et al., 2019), are associated with precipitation amount decrease along the equatorward margin and increase along the poleward margin of the convergenze zone (Zilli et al., 2019). Several observational studies identified delayed onsets of the SAmerM after 1978 related to longer dry seasons in the southern Amazon (Fu et al., 2013; Yin et al., 2014; Arias et al., 2015; Debortoli et al., 2015; Arvor et al., 2017; Giráldez et al., 2020; Haghtalab et al., 2020; Correa et al., 2021). In contrast, other studies INDICate a trend toward earlier onsets of the SAmerM (Jones and Carvalho, 2013). These discrepancies are explained by the methodology used and"
AR6_WG1_8_31,8,45,"Significant increases in precipitation have been observed over – south-eastern Brazil during 1902 2005 while non-significant decreases have been found over central Brazil (Vera and Díaz, – 2015). In Bolivia, increases were observed during 1965 1984, while reductions have occurred since then (Seiler et al., 2013). However, the Peruvian Amazon does not reveal significant changes in mean rainfall during 1965–2007 (Lavado et al., 2013; Ronchail et al., 2018). Historical simulations from CMIP5 ensembles adequately capture the observed summer precipitation amount over central and south- eastern Brazil, thereby providing high confidence in interpreting the – observed variability of SAmerM for the period 1960 1999 (Gulizia and Camilloni, 2015; Pascale et al., 2019). Also, CMIP5 simulations INDICate that the anthropogenic forcing associated with increased GHG emissions is necessary to explain the positive trends in upper- troposphere zonal winds observed over the South American Altiplano (Vera et al., 2019). However, the detection of anthropogenically- induced signals for precipitation is still ambiguous in monsoon regions, like the SAmerM (Hoegh-Guldberg et al., 2018)."
AR6_WG1_8_32,8,45,"Since AR5, several studies have examined observed variability and changes in the Australian and Maritime Continent monsoon (AusMCM) using paleoclimate records, instrumental observations and modeling studies (Denniston et al., 2016; Zhang and Moise, 2016). Paleoclimate reconstructions and modelling INDICate that the Indo–Australian monsoon may vary in or out of phase with the EAsiaM, depending on whether there is a meridional displacement or expansion of the tropical rainfall belt (Ayliffe et al., 2013; Denniston et al., 2016). For instance, mid-Holocene simulations suggest that the AusMCM weakens and contracts due to a decreased net energy input and a weaker dynamic component (D’Agostino et al., 2020b)."
AR6_WG1_8_33,8,46,"The Maritime Continent (MC) experiences the influence of both the Asian and the Australian monsoons, with rainfall peaking during boreal winter/austral summer (Robertson et al., 2011). Reductions in land rainfall and marine cloudiness over the MC and weakening of surface moisture flux convergence have been observed in the period – 1950 1999 (Tokinaga et al., 2012; Yoden et al., 2017). These trends are INDICative of a slowdown of the Walker Circulation, with positive sea level pressure trends over the MC and negative trends over the central equatorial Pacific (Tokinaga et al., 2012). More recently – (1981 2014), a trend of increasing annual rainfall over large areas of the MC has been identified (Hassim and Timbal, 2019). Given the large variability in MC rainfall on interannual time scales, the choice of time period may influence the calculated rainfall trend (Hassim and Timbal, 2019). –"
AR6_WG1_8_34,8,46,"In addition to evidence that rain-rates have increased, there is evidence that TC translation speed has slowed globally (Kossin, 2018) thus amplifying thermodynamic intensification of rainfall and may be linked to anthropogenic forcing (Gutmann et al., 2018). This is limited evidence however, so there is medium confidence of a detectable change in TC translation speed over the US. Since the 1900s, and there is low confidence for a global signal because of limited agreement among models and due to data heterogeneity. However, the slowdown is consistent with theoretical and modelling studies that INDICate a general weakening of the tropical circulation with warming that reduces the speed of the TC system (Chauvin et al., 2017), though there is limited observational evidence (Sections 8.2.3.5 and 11.7.1)."
AR6_WG1_8_35,8,47,"In contrast, it has been shown that observed trends in blocking are sensitive the choice of the blocking INDEX, and that there is a large internal variability that complicates the detection of forced trends (Barnes et al., 2014; Cattiaux et al., 2016; Woollings et al., 2018), compromising the attribution of any observed changes in blocking. Many climate models still underestimate the occurrence of blocking, at least in winter over north-eastern Atlantic and Europe (Dunn- Sigouin and Son, 2013), which leads to caution in the interpretation of their results for these regions. However, over the Pacific Ocean there have been large improvements in the simulation of blocking for the last 20 years (Davini and D’Andrea, 2016; Patterson et al., 2019). In the SH, increases in blocking frequency have occurred in the South Atlantic in austral summer (Dennison et al., 2016) and in the southern Indian Ocean in austral spring (Schemm, 2018). A reduced blocking frequency has been found over the south-western Pacific in austral spring (Sections 2.3.1.4.3 and 3.4.1.3.3; Schemm, 2018)."
AR6_WG1_8_36,8,47,"The AR5 INDICated low confidence in long-term changes in the intensity of extratropical cyclones (ETC) over the 20th century derived from centennial reanalyses and storminess proxies based upon sea level pressure. This was confirmed by the SREX assessment that the main Northern Hemisphere (NH) and Southern Hemisphere (SH) extratropical storm tracks likely experienced a poleward shift during the last 50 years (Seneviratne et al., 2012) with low confidence, and inconsistencies within reanalysis datasets remain."
AR6_WG1_8_37,8,53,"Over global land there is a small range in global mean multi- model mean precipitation increase across scenarios in the mid- – – term (2.6 4.0 %), which widens (to 2.6 8.8 %) in the long-term (Table 8.1). The long-term projections are consistent with the Chapter 4 assessment that global annual precipitation over land is – projected to increase on average by 2.4 [ 0.2 to +4.7] % (likely range) in the SSP1-1.9 low-emissions scenario and by 8.3 [0.9 to 12.9] % in the SSP5-8.5 high emissions scenario by 2081–2100 relative to 1995–2014. Small differences in assessed model mean changes in Chapter 4, Table 4.2 result from a slightly different set of models – considered for Table 8.1. Over land, P–E increases by around 2 3% in the mid-term (apart from SSP5-8.5 where increases are almost – 5%) and around 1 12% in the long-term, determined by increased moisture transport from the ocean to land (Section 8.4.1.2). Runoff increases are larger and less certain due to additional inputs from glacier melt and changes in groundwater storage (Section 8.4.1.7). Overall, precipitation and runoff are very likely to increase over the global land in all scenarios in the mid- and long term. P–E is likely to increase over global land in the mid- and long term and very likely in SSP1-1.9, SSP3-7.0 and SSP5-8.5 pathways. The mid-term consistency in projections across scenarios is not apparent for precipitable water – vapour, which increases over land by around 6 15% in the mid-term – and 5 36% in the long-term across all scenarios. This implies that increases in extreme precipitation (closely related to atmospheric water vapour content; Section 8.2.3.2) are dependent on mitigation pathway, even in the mid-term (Section 11.4.5). Water vapour residence time (computed as the ratio of precipitable water vapour to precipitation from values in Table 8.1) increases from eight days in the present to nine days in mid-term and up to about ten days in the long-term over land in SSP3-7.0, INDICating a longer time to moisten the atmosphere between precipitation events. The CMIP6 projections are therefore consistent with an intensification but not acceleration of the global water cycle."
AR6_WG1_8_38,8,56,"The AR5 identified that high-latitude precipitation increase may lead to an increase in snowfall in the coldest regions and a decrease of snowfall in warmer regions due to a decreased number of freezing days. The fraction of precipitation falling as snow and the duration of snow cover was projected to decrease. Heavy snowfall events globally are not expected to decrease significantly with warming as they occur close to the water freezing point, which will migrate poleward and in altitude (O’Gorman, 2014; Turner et al., 2019). There are only a small number of studies evaluating the implications of this mechanism in specific regions. A study for the north-eastern USA INDICates smaller reductions for major snowfall events against the broader decline in snowfall expected from thermodynamic effects (Bintanja and Andry, 2017). Arctic snowfall is projected to decrease as rainfall makes up more of the precipitation (Zarzycki, 2018)."
AR6_WG1_8_39,8,59,"In summary, it is virtually certain that global precipitation will increase with warming due to increases in GHG concentrations and decreases in air pollution. There is high confidence that total precipitation will increase in the high latitudes, with a shift from snowfall to rainfall except in the coldest regions and seasons. There is also high confidence that precipitation will decrease over the Mediterranean, southern Africa, Amazonia, Central America, south-western South America, south-western Australia and coastal West Africa and that monsoon precipitation will increase over South Asia, East Asia and central-eastern Sahel. See Section 8.4.2.4 for a more detailed assessment of changes in regional monsoons. Daily mean precipitation intensities, including extremes, are projected to increase over most regions (high confidence). The number of dry days is projected to increase over the subtropics, Amazonia, and Central America (medium confidence). There is high confidence in an overall increase in precipitation variability over most land areas. seasonality and SRCCL mostly emphasized changes in vegetation published, but often with conflicting results. Based on three in – over 62% of the terrestrial ecosystems analysed from 1950 2009 data show a general increase in the annual range of precipitation et al., 2013). This paradox may be partly explained by a larger as by internal variability (Kumar et al., 2015; see also Box 8.1). For trends in the 1980s and 1990s (Nicholson, 2017), which was linked followed by a recent recovery that was linked to internal variability rainfall seasonality in the tropics but an increased seasonality in (Marvel et al., 2017). datasets, with no region showing a consistent, statistically (X. Tan et al., 2020). Regional studies suggest that observed changes the 20th century (X. Li et al., 2016; Mallakpour and Villarini, 2017; is growing evidence that contrasts between wet and dry regimes, et al., 2013; Murray-Tortarolo et al., 2016; Tapiador et al., 2016; 2018; Lan et al., 2019; Liang et al., 2020; Schurer et al., 2020). duration of wet seasons. A later monsoon onset trend was reported an earlier rainfall onset was implicated in increased springtime 2017a). Winter and early spring precipitation over the north-western daily precipitation extremes in association with enhanced amplitude Disturbances’(Madhura et al., 2014; Cannon et al., 2015; Krishnan (Deng et al., 2019). In the African Sahel, rainfall has been most 20th century (Biasutti, 2019). A shift in the seasonality of Sahelian 10.4.2.1; Nicholson, 2013; Dunning et al., 2018). Over southern Africa, historical and projected future delay in the wet season (Maidment the North American monsoon has been observed from 1978 to 2009 INDICate delayed onsets since 1978 (Fu et al., 2013; Yin et al., et al., 2020; Haghtalab et al., 2020; Correa et al., 2021). is mainly due to an earlier onset of spring snowmelt (Peng et al., (Najafi et al., 2016). Changes in snow seasonality affect streamflow decrease of low-level flow in summer (Berghuijs et al., 2014; Kang the low-level flow in mountain catchments (Lutz et al., 2014; Milner"
AR6_WG1_8_40,8,63,"In summary, future projections INDICate that anthropogenic forcings will drive an increase in global mean evaporation over most oceanic areas (high confidence) (Figure 8.17), an increase in global atmospheric demand (virtually certain) and an increase in evapotranspiration over most land areas, with the exception of moisture-limited regions (medium confidence). However, substantial uncertainties in projections of evapotranspiration, especially at seasonal and regional scales, remain (see also Section 8.2.3.3 and Cross-Chapter Box 5.1)."
AR6_WG1_8_41,8,65,"Although there are regions where multiple models predict consistent and significant changes in soil moisture, as with evapotranspiration (Section 8.4.1.4), there is still uncertainty in these projections related to the response of plants to elevated CO . Most models project increases in two variables that have opposite effects on surface water availability: plant water use efficiency (WUE) and leaf area INDEX (LAI; see Section 8.4.1.4). As discussed in Sections 8.2.3.3, 8.3.1.4 and 8.4.1.4, there is low confidence in how these changes in plant physiology will affect future projections of evapotranspiration, and likewise, drought and aridity."
AR6_WG1_8_42,8,66,"southern Africa, and south-western Australia, on the order of 0.5 to 1 month for a moderate emissions scenario (SSP2-4.5) and two months for a high-emissions scenario (SSP5-8.5; Ukkola et al., 2020). Drought intensity is projected to increase in the tropics, mainly in the Amazonian basin, Central Africa, and southern Asia, as well as in Central America and south-western South America (Ukkola et al., 2020). The CORDEX South Asia multi-model ensemble projections INDICate an increase in the frequency and severity of droughts over central and northern India during the 21st century, under the RCP4.5 and RCP8.5 scenarios (medium confidence) (Mujumdar et al., 2020). Under intermediate or high-emissions scenarios, the likelihood of extreme droughts (events that have magnitudes equal to or less than the 10th percentile of the 1851–1880 baseline period) increases by 200–300% in the Amazonian basin, south-western North America, Central America, the Mediterranean, southern Africa, and south- western South America (Cook et al., 2020). Even under a low- emissions scenario (SSP1-2.6), the likelihood of extreme droughts increases by 100% in south-western North America, south-western South America, the Amazon, the Mediterranean, and southern Africa (Cook et al., 2020). Thus, there is high confidence that drought severity and intensity will increase in the Mediterranean, southern Africa, south-western South America, south-western North America, south-western Australia, Central America and the Amazonian basin."
AR6_WG1_8_43,8,66,"Paleoclimate records provide context for these future expected changes in drought and aridity. In the Mediterranean, western North America, and Central Chile, there is high confidence that climate change will shift soil moisture (as represented by the Palmer Drought Severity INDEX) outside the range of observed and reconstructed values spanning the last millennium (Figure 8.20; Cook et al., 2014; Otto-Bliesner et al., 2016). Warmer temperatures, leading to increased evaporative losses, are clearly implicated in the projected future drying in these semi-arid regions (Dai et al., 2018), emphasizing the central role that warming plays in driving increased evaporative demand (Vicente-Serrano et al., 2020). In contrast, future trajectories are more uncertain in regions like Central Asia and eastern Australia–New Zealand where projected changes in precipitation and soil moisture are less coherent (Figure 8.19 and 8.20; Hessl et al., 2018). More information on projected changes in drought, including specific categories or drought, can be found in Section 11.6.5 and Section 12.4."
AR6_WG1_8_44,8,68,"Global glacier mass loss projections show a scenario-dependent geographic partitioning of when peak in runoff occurs (Marzeion et al., 2020), consistent with previous studies (Radić et al., 2014; Huss and Hock, 2018; Hock et al., 2019b). Under a low-emissions scenario (Marzeion et al., 2020) all regions exhibit runoff in the decades prior to 2050. Under a high-emissions scenario however, low- and mid-latitude regions show peak runoff before approximately 2060, – whereas Arctic regions peak in later decades around 2070 2090. Antarctic glacier losses will not have peaked by the end of the century in the high-emissions scenario. Globally, peak runoff of 2.5 to 3 mm yr –1 sea level equivalent occurs around 2090 (Marzeion et al., 2020). Regional projections are presented in detail in Section 9.5.1 and Figure 9.21, and briefly summarized below. Himalaya and Central Asia: Glaciers in the Himalayas feed ten of the world’s most important river systems and are critical water sources for nearly two billion people (Wester et al., 2019). However, they are some of the most vulnerable ‘water towers’ (Immerzeel et al., 2020) that are projected to experience volume losses of approximately 30 to 100% by 2100 depending on global emissions scenarios (Marzeion et al., 2020). Under mid-range emissions scenarios glaciers in this region are projected to reach peak runoff during the period 2020 to 2040 (Marzeion et al., 2020). Alaska, Yukon, British Columbia: Post-AR5 but pre-SROCC projections INDICated a potential 70 ± 10% reduced volume of glacier ice in western Canada relative to 2005 (Clarke et al., 2015), with few glaciers remaining in the Interior and Rockies regions and maritime glaciers in north-western British Columbia surviving only in a diminished state. Recent global projections support these earlier findings, showing that glacier mass in western Canada and the USA may reduce by 50% under low-emissions scenarios and be completely lost under the highest emissions and most sensitive glacier model combinations (Figure 9.21; Marzeion et al., 2020). Arctic Canada and Alaskan glaciers are projected to experience more modest mass loss (0–60% depending on region, scenario, and model; Marzeion et al., 2020)."
AR6_WG1_8_45,8,69,"The AR5 did not include specific projections for wetlands and lakes. The SRCCL and SROCC provided some discussion of wetlands projections. For coastal wetlands, SRCCL noted the importance of sea level rise for increased saltwater intrusion, although projections of coastal wetland area with sea level rise are inconclusive. Some studies project substantial decreases (Spencer et al., 2016) while others INDICate possible increases (Schuerch et al., 2018). SRCCL also noted the general expectation for decreases in water resources, including wetlands, in areas of decreased rainfall due to increased evaporation."
AR6_WG1_8_46,8,71,"In summary, there is high confidence that the Pacific Walker circulation will weaken by the end of the 21st century, and will be associated with decreased precipitation over the western tropical Pacific and increases farther east. Discrepancies between observed and simulated changes in SSTs in the tropics INDICate that a temporary strengthening of the Walker Circulation can arise from a transient response to GHG radiative forcing (low confidence) and from internal variability (medium confidence)."
AR6_WG1_8_47,8,73,"Percentage and Ajayamohan, 2015). Greater warming over the Asian land region compared to the ocean contributes to intensification of the monsoon low-level south-westerly winds and precipitation (Endo et al., 2018), even though the combined effect of upper and lower tropospheric warming makes the Asian monsoon circulation response rather complicated. A high resolution model projection, based on the RCP8.5 scenario, INDICates that a northward shift of the low-level jet and associated weakening of the large-scale monsoon circulation can induce a large reduction in the genesis of monsoon low pressure systems by the late 21st century (Sandeep et al., 2018). Experiments with constant forcing INDICate that at 1.5°C and 2°C global warming levels, mean precipitation and monsoon extremes are projected to intensify in summer over India and South Asia (Chevuturi et al., 2018; D. Lee et al., 2018) and that a 0.5°C difference would imply a 3% increase of precipitation (Chevuturi et al., 2018). CMIP5 models project an increase in short intense active days and decrease in long active days, with no significant change in the number of break spells for India (Sudeepkumar et al., 2018)."
AR6_WG1_8_48,8,75,"diversity in the future aerosol emissions pathways and policies for regulating air pollution (Wilcox et al., 2020). Additionally, near-term projections of SAsiaM precipitation are expected to be constrained by internal variability associated with the PDV (X. Huang et al., 2020a). CMIP6 models also INDICate a lengthening of the summer monsoon over India by the end of the 21st century, at least in SSP2-4.5, with considerable inter-model spread in the projected late retreat (Ha et al., 2020)."
AR6_WG1_8_49,8,75,"CMIP5 projections INDICated a possible intensification of the EAsiaM circulation during the 21st century, in addition to precipitation increase, although there is a lack of consensus on changes in the western North Pacific subtropical high, this is an important feature of the EAsiaM circulation (Kitoh, 2017). Furthermore, the EAsiaM precipitation enhancements in the CMIP5 projections are prominent over the southern part of the Baiu rainband by the late 21st century, with no significant changes in the Meiyu precipitation over central- eastern China (Horinouchi et al., 2019). It was also shown that the Baiu precipitation response in CMIP5 projections is accompanied by a southward retreat of the western North Pacific subtropical high and a southward shift of the East Asian subtropical jet (Horinouchi et al., 2019). According to the high-resolution MRI-AGCM global warming experiments, future summer precipitation could potentially increase on the southern side and decrease on the northern side of the present- day Baiu location in response to downward-motion tendencies which can offset the ‘wet-gets-wetter’ effect, but is subject to large model uncertainties (Ose, 2019). Future projections of land warming over – the Eurasian continent (Endo et al., 2018) and intensified land sea thermal contrast (Z. Wang et al., 2016; Tian et al., 2019) can potentially intensify the EAsiaM circulation during the 21st century. However, there are large uncertainties in projected water cycle changes over the region (Endo et al., 2018), mostly in the near-term because of uncertainties in future aerosol emissions scenarios (Wilcox et al., 2020), as well as due to the interplay between internal variability and anthropogenic external forcing (Wang et al., 2021)."
AR6_WG1_8_50,8,76,"In summary, post-AR5 studies and newly available CMIP6 results INDICate projected rainfall increases in the eastern-central WAfriM region but decreases in the west (high confidence), with a delayed wet season (medium confidence). Overall, WAfriM summer precipitation is projected to increase during the 21st century but with larger uncertainty noted under high-emissions scenarios (medium confidence)."
