indic_id,chapter,page,paragraph
AR6_WG1_1_1,1,9,"naturally forced changes (Chapter 3, Sections 1.2.1.1 and 1.4.1, and the Cross-Working Group Box on Attribution). The core assessment conclusions from previous IPCC reports are confirmed or strengthened in this report, INDICating the robustness of our understanding of the primary causes and consequences of anthropogenic climate change."
AR6_WG1_1_2,1,13,"system have continued, and these are assessed in full in later chapters. Here, we summarize changes to a set of key large-scale climate INDICATORs over the modern era (1850 to present). We also discuss the changes in relation to the longer-term evolution of the climate. These ongoing changes throughout the climate system form a key part of the context of the present Report."
AR6_WG1_1_3,1,13,1.2.1.1 Recent Changes in Multiple Climate INDICATORs
AR6_WG1_1_4,1,13,"Figure 1.4 documents that the climate system is undergoing a comprehensive set of changes. It shows a selection of key INDICATORs of change through the instrumental era that are assessed and presented in the subsequent chapters of this report. Annual mean values are shown as stripes, with colours INDICating their value. The transitions from one colour to another over time illustrate how conditions are shifting in all components of the climate system. For these particular INDICATORs, the observed changes go beyond the yearly and decadal variability of the climate system. In this Report, this is termed an ‘emergence’ of the climate signal (Section 1.4.2 and FAQ 1.2)."
AR6_WG1_1_5,1,14,"The hydrological (or water) cycle is also changing and is assessed to be intensifying, through a higher exchange of water between the surface and the atmosphere (Sections 2.3 and 8.3). The resulting regional patterns of changes to precipitation are, however, different from surface temperature change, and interannual variability is larger, as illustrated in Figure 1.4. Annual land area mean precipitation in the Northern Hemisphere temperate regions has increased, while the subtropical dry regions have experienced a decrease in precipitation in recent decades (Section 2.3). The cryosphere is undergoing rapid changes, with increased melting and loss of frozen water mass in most regions. This includes all frozen parts of the globe, such as terrestrial snow, permafrost, sea ice, glaciers, freshwater ice, solid precipitation, and the ice sheets covering Greenland and Antarctica (Chapter 9; SROCC, IPCC, 2019b). Figure 1.4 illustrates how, globally, glaciers have been increasingly losing mass for the last fifty years. The total glacier mass in the most recent decade (2010–2019) was the lowest since the beginning of the 20th century (Sections 2.3 and 9.5). The global ocean has warmed unabatedly since at least 1970 (Sections 1.3, 2.3 and 9.2; SROCC, IPCC, 2019b). Figure 1.4 shows how the averaged ocean heat content is steadily increasing, with a total increase of [0.28 to 0.55] yottajoule (YJ; 10 24 joule) between 1971 and 2018 (Section 9.2). In response to this ocean warming, as well as to the loss of mass from glaciers and ice sheets, the global mean sea level (GMSL) has risen by 0.20 [0.15 to 0.25] metres between 1900 and 2018. GMSL rise has accelerated since the late 1960s (see Section 9.6). Overall, the changes in these selected climatic INDICATORs have progressed beyond the range of natural year-to-year variability (Chapters 2, 3, 8 and 9, and Sections 1.2.1.2 and 1.4.2). The INDICATORs presented in Figure 1.4 document a broad set of concurrent and emerging changes across the physical climate system. All INDICATORs shown here, along with many others, are further presented in the coming chapters, together with a rigorous assessment of the supporting scientific literature. Later chapters (Chapters 10, 11, 12 and Atlas) present similar assessments at the regional level, where observed changes do not always align with the global mean picture shown here."
AR6_WG1_1_6,1,16,"This establishes an essential long-term context for the climate change of the past 150 years and the projected changes in the 21st century and beyond (Chapter 3; IPCC, 2013a; Masson-Delmotte et al., 2013). Figure 1.5 shows reconstructions of three key INDICATORs of climate change over the past 800,000 years (800 kyr) 2 – atmospheric CO concentrations, global mean surface temperature (GMST) and global mean sea level (GMSL) – comprising at least eight complete glacial–interglacial cycles (EPICA Community Members, 2004; Jouzel et al., 2007), which are largely driven by oscillations in the Earth’s orbit and consequent feedbacks on multi-millennial time scales (Berger, 1978; Laskar et al., 1993). The dominant cycles – recurring approximately every 100 kyr – can be found imprinted in the natural variations of these three key INDICATORs. Before industrialisation, atmospheric CO concentrations varied between 174 ppm and 300 ppm, as measured directly in air trapped in ice at Dome Concordia, Antarctica (Bereiter et al., 2015; Nehrbass-Ahles et al., 2020). Relative to 1850–1900 CE, the reconstructed GMST changed in the range of –6°C to +1°C across these glacial–interglacial cycles (see Chapter 2, Section 2.3.1 for an assessment of different paleo-reference periods). GMSL varied between about –130 m during the coldest glacial maxima and +5 to +25 m during the warmest interglacial periods (Chapter 2; Spratt and Lisiecki, 2016). They represent the amplitudes of natural, global-scale climate variations over the last 800 kyr prior to the influence of human activity. Further climate information from a variety of paleoclimatic archives is assessed in Chapters 2, 5, 7 and 9."
AR6_WG1_1_7,1,16,"Paleoclimatic information also provides a long-term perspective on rates of change of these three key INDICATORs. In high-resolution reconstructions from polor ice cores, the rate of increase in atmospheric CO observed over 1919–2019 CE is one order of magnitude higher than the fastest CO fluctuations documented during the Last Glacial Maximum and the last deglacial transition (Marcott et al., 2014, see Chapter 2, Section 2.2.3.2.1). Current multi- decadal GMST exhibit a higher rate of increase than over the past 2 kyr (Section 2.3.1.1.2; PAGES 2k Consortium, 2019), and in the 20th century GMSL rise was faster than during any other century over the past 3 kyr (Section 2.3.3.3)."
AR6_WG1_1_8,1,16,"Paleoclimate records also show centennial- to millennial-scale variations, particularly during the ice ages, which INDICate rapid or abrupt changes of the Atlantic Meridional Overturning Circulation (AMOC; Section 9.2.3.1) and the occurrence of a ‘bipolar seesaw’ (opposite-phase surface temperature changes in both hemispheres; Section 2.3.3.4.1; Stocker and Johnsen, 2003; EPICA Community Members, 2006; WAIS Divide Project Members et al., 2015; Lynch- Stieglitz, 2017; Pedro et al., 2018; Weijer et al., 2019). This process suggests that instabilities and irreversible changes could be triggered if critical thresholds are passed (Section 1.4.4.3). Several other processes involving instabilities are identified in climate models (Drijfhout et al., 2015), some of which may now be close to critical thresholds (Section 1.4.4.3; see also Chapters 5, 8 and 9 regarding tipping points; Joughin et al., 2014)."
AR6_WG1_1_9,1,16,"Based on Figure 1.5, the reconstructed, observed and projected ranges of changes in the three key INDICATORs can be compared. By the first decade of the 20th century, atmospheric CO concentrations had already moved outside the reconstructed range of natural variation"
AR6_WG1_1_10,1,25,"Throughout IPCC reports, the calibrated language INDICating a formal confidence). Where appropriate, findings can also be formulated"
AR6_WG1_1_11,1,25,"Likelihood can INDICate probabilities for single events or broader or modelling analyses, other quantitative analyses, or expert elicitation. present probability more precisely than can be done with the likelihood percentile ranges, including quantification of tails of distributions, Mach et al., 2017). In some instances, multiple combinations of"
AR6_WG1_1_12,1,25,"communicating authors’ expert judgments (Mastrandrea and Mach, 2011). During the AR5 cycle, this calibrated uncertainty language was updated and unified across all Working Groups (Mastrandrea et al., 2010, 2011). Box 1.1 summarizes this framework as it is used in AR6. Uncertainty Language in AR6 1), as described in the ‘Guidance Notes for Lead Authors of the IPCC (Mastrandrea et al., 2010). The uncertainty Guidance Note used of confidence and the quantitative representation of uncertainty emphasizes traceability of the assessment throughout the Summary are supported in the chapter text by a summary of the confidence, and also likelihood, if applicable. scientific understanding and use two metrics to communicate the based on the type, amount, quality and consistency of evidence judgment) and the degree of agreement. expressed probabilistically (e.g., based on statistical analysis of by the author team or from a formal quantitative survey of expert confidence assessment is clearly identified by italics (e.g., medium as statements of fact without uncertainty qualifiers. step-by-step process by which IPCC authors assess scientific the available evidence and agreement (steps 1–2). The following medium, or robust; and the degree of agreement: low, medium, or consistent, independent lines of high-quality evidence. and agreement, the level of confidence can be evaluated. In this a single metric (steps 3–5). The assessed level of confidence is very high. Step 4 depicts how summary statements for evidence and agreement statement, different confidence levels can be assigned degrees of agreement correlate with increasing confidence. When mean that confidence in its opposite is high, and vice versa. instead, it means that the statement is the best conclusion based on progress may change the level of confidence in any finding in is sufficient confidence and quantitative/probabilistic evidence, (steps 5–6). Unless otherwise INDICated, likelihood statements is high or very high. Terms used to INDICate the assessed very likely: 90–100%, likely: 66–100%, about as likely as not: unlikely: 0–1%. Additional terms (extremely likely: 95–100%, more be used when appropriate. outcomes. The probabilistic information may build from statistical The framework encourages authors, where appropriate, to scale, for example with complete probability distributions or which are important for risk management (Sections 1.2.2 and 1.4.4; confidence and likelihood are possible to characterize key findings"
AR6_WG1_1_13,1,27,"Budescu et al. (2014) surveyed 25 samples in 24 countries (a total of 10,792 individual responses), finding that even when shown IPCC uncertainty guidance, lay readers systematically misunderstood IPCC likelihood statements. When presented with a ‘high likelihood’ statement, they understood it as INDICating a lower likelihood than intended by the IPCC authors. Conversely, they interpreted ‘low likelihood’ statements as INDICating a higher likelihood than intended. In another study, British lay readers interpreted uncertainty language somewhat differently from IPCC guidance, but Chinese lay people reading the same uncertainty language translated into Chinese differed much more in their interpretations (Harris et al., 2013). Further, even though it is objectively more probable that wide uncertainty intervals will encompass true values, wide intervals were interpreted by lay people as implying subjective uncertainty or lack of knowledge on the part of scientists (Løhre et al., 2019). Mach et al. (2017) investigated the advances and challenges in approaches to expert judgment in AR5. Their analysis showed that the shared framework increased the overall comparability of assessment conclusions across all Working Groups and topics related to climate change, from the physical science basis to resulting impacts, risks, and options for response. Nevertheless, many challenges in developing and communicating assessment conclusions persist, especially for findings drawn from multiple disciplines and Working Groups, for subjective aspects of judgements, and for findings with substantial uncertainties (Adler and Hirsch Hadorn, 2014). In summary, the calibrated language cannot entirely prevent misunderstandings, including a tendency to systematically underestimate the probability of the IPCC’s higher-likelihood conclusions and overestimate the probability of the lower-likelihood ones (high confidence). However, a consistent and systematic approach across Working Groups to communicate the assessment outcomes is an important characteristic of the IPCC."
AR6_WG1_1_14,1,27,"The framework for communicating uncertainties does not allow for INDICating cases where ‘deep uncertainty’ is identified in the assessment (Adler and Hirsch Hadorn, 2014). The definition of deep uncertainty in IPCC assessments has been described in the context of SROCC (IPCC, 2019b; Box 5 in Abram et al., 2019): a situation of deep uncertainty exists when experts or stakeholders do not know or cannot agree on: (i) appropriate conceptual models that describe relationships among key driving forces in a system; (ii) the probability distributions used to represent uncertainty about key variables and parameters; and/or (iii) how to weigh and value desirable alternative outcomes (Cross-Chapter Box 1.2 and Annex VII: Glossary; Abram et al., 2019). Since AR5, ‘storylines’ or ‘narratives’ approaches have been used to address issues related to deep uncertainty, for example low-likelihood events that would have high impact if they occurred, to better inform risk assessment and decision making (Section 1.4.4)."
AR6_WG1_1_15,1,28,"In AR6, ‘climate information’ refers to specific information about the past, current or future state of the climate system that is relevant for mitigation, adaptation and risk management. Cross-Chapter Box 1.1 is an example of climate information at the global scale. It provides climate change information with potential relevance for the global stocktake, and INDICates where in AR6 this information may be found. Responding to national and regional policymakers’ needs for tailored information relevant to risk assessment and adaptation, AR6 emphasizes assessment of regional information more than earlier reports. Here the phrase ‘regional climate information’ refers to predefined reference sets of land and ocean regions; various typological domains (such as mountains or monsoons); temporal frames including baseline periods as well as near term (2021–2040), medium term (2041–2060) and long term (2081–2100); and global warming levels (Chapters 10 and 12, Sections 1.4.1 and 1.4.5, and Atlas). Regional climate change information is constructed from multiple lines of evidence including observations, paleoclimate proxies, reanalyses, attribution of changes and climate model projections from both global and regional climate models (Sections 1.5.3 and 10.2–10.4). The constructed regional information needs to take account of user context and values for risk assessment, adaptation and policy decisions (Sections 1.2.3 and 10.5)."
AR6_WG1_1_16,1,32,"315 ppm in 1958 to 414 ppm in 2020. Ground-based monitoring of other GHGs followed. The Greenhouse Gases Observing Satellite (GOSat) was launched in 2009, and two Orbiting Carbon Observatory satellite instruments have been in orbit since 2014. The AR5 WGI highlighted ‘the other CO problem’ (Doney et al., 2009), that is, ocean acidification caused by the absorption of some 20–30% of anthropogenic CO from the atmosphere and its conversion to carbonic acid in seawater. The AR5 WGI assessed that the pH of ocean surface water has decreased by 0.1 since the beginning of the industrial era (high confidence), INDICating approximately a 30% increase in acidity (IPCC, 2013b)."
AR6_WG1_1_17,1,38,"A key INDICATOR of climate understanding is whether theoretical climate system budgets or ‘inventories’, such as the balance of incoming and outgoing energy at the surface and at the top of the atmosphere, can be quantified and balanced observationally. The global energy budget, for example, includes energy retained in the atmosphere, upper ocean, deep ocean, ice, and land surface. Church et al. (2013) assessed in AR5 with high confidence that independent estimates of effective radiative forcing (ERF), observed heat storage, and surface warming combined to give an energy budget for the Earth that is"
AR6_WG1_1_18,1,45,"Several baselines or reference periods are used consistently throughout AR6 WGI. Baseline refers to a period against which differences are calculated, whereas reference period is used more generally to INDICate a time period of interest, or a period over which some relevant statistics are calculated (Glossary). Variations in observed and simulated climate variables over time are often presented as ‘anomalies’, that is, the differences relative to a baseline, rather than using the absolute values. This is done for several reasons. deemed very unlikely (albeit with medium confidence due to known consistent with 1.5°C global warming over the 21st century. Building between cumulative net anthropogenic CO emissions since assessed the remaining carbon budgets compatible with the 1.5°C 2018, the remaining carbon budget for a one-in-two (50%) chance 420 GtCO for a two-in-three (66%) chance (medium confidence). by about the years 2032 and 2028, respectively. Using GMST (medium confidence). Each budget is further reduced by permafrost and other less well represented Earth system feedbacks of 1.5°C imply that global net anthropogenic CO emissions reaching net zero around 2050, together with deep reductions in To limit global warming to below 2°C, CO emissions would have First, anomalies are often used when combining data from multiple locations, because the absolute values can vary over small spatial scales which are not densely observed or simulated, whereas anomalies are representative for much larger scales (e.g., for temperature; Hansen and Lebedeff, 1987). Since their baseline value is zero by definition, anomalies are also less susceptible to biases arising from changes in the observational network. Second, the seasonality in different climate INDICATORs can be removed using anomalies to more clearly distinguish variability from long-term trends."
AR6_WG1_1_19,1,45,"Third, different datasets can have different absolute values for the same climate variable that should be removed to allow effective comparisons of variations over time. This is often required when comparing climate simulations with each other, or when comparing simulations with observations, as simulated climate variables are also affected by model bias that can be removed when they are presented as anomalies. It can also be required when comparing observational datasets or reanalyses (Section 1.5.2) with each other, due to systematic differences in the underlying measurement system (Figure 1.11). Understanding the reasons for any absolute difference is important, but whether the simulated absolute value matters when projecting future change will depend on the variable of interest. For example, there is not a strong relationship between climate sensitivity of a model (which is an INDICATOR of the degree of future warming) and the simulated absolute global surface temperature (Mauritsen et al., 2012; Hawkins and Sutton, 2016)."
AR6_WG1_1_20,1,47,"GMST variable being considered, the rates of change of the variable and the purpose of the chosen period, but is usually 20 to 50 years long. The World Meteorological Organization (WMO) uses 30-year periods to define ‘climate normals’, which INDICate conditions expected to be experienced in a given location."
AR6_WG1_1_21,1,50,"see Section 1.5.4.2). A set of illustrative examples using one such large ensemble (Maher et al., 2019) demonstrates how variability can influence trends on decadal time scales (Figure 1.13). The long- term anthropogenic trends in this set of climate INDICATORs are clearly apparent when considering the ensemble as a whole (grey shading), and all the individual ensemble members have very similar trends for ocean heat content (OHC), which is a robust estimate of the total energy stored in the climate system (e.g., Palmer and McNeall, 2014). However, the individual ensemble members can exhibit very different decadal trends in global surface air temperature (GSAT), UK summer temperatures, and Arctic sea ice variations. More specifically, for a representative 11-year period, both positive and negative trends can be found in all these surface INDICATORs, even though the long- term trend is for increasing temperatures and decreasing sea ice. Periods in which the long-term trend is substantially masked or enhanced for more than 20 years are also visible in these regional examples. This highlights the fact that observations are expected to exhibit short-term trends which are larger or smaller than the long-term trend or that differ from the average projected trend from climate models, especially on continental spatial scales or smaller (Cross-Chapter Box 3.1). The actual observed trajectory can be considered as one realization of many possible alternative worlds that experienced different weather; this is also demonstrated by changes in climate the construction of ‘observation-based large ensembles’, which are alternate possible realizations of historical observations that retain the statistical properties of observed regional weather (e.g., McKinnon and Deser, 2018)."
AR6_WG1_1_22,1,55,"In the broader IPCC context, the term ‘scenario storyline’ refers to a narrative description of one or more scenarios, highlighting their main characteristics, relationships between key driving forces and the dynamics of their evolution (e.g., emissions of short-lived climate forcers assessed in Chapter 6 are driven by ‘scenario storylines’; see Section 1.6). The AR6 WGI is mainly concerned with ‘physical climate storylines’. A physical climate storyline is a self-consistent and plausible physical trajectory of the climate system, or a weather or climate event, on time scales from hours to multiple decades (T.G. Shepherd et al., 2018). This approach can be used to constrain projected changes or specific events on specified explanatory elements such as projected changes of large-scale INDICATORs (Box 10.2). For example, Hazeleger et al. (2015) suggested using ‘tales of future weather’, blending numerical weather prediction with a climate projection to illustrate the potential behaviour of future high-impact events (also see Hegdahl et al., 2020). Several studies describe how possible large changes in atmospheric circulation"
AR6_WG1_1_23,1,58,"Such paleoclimate evidence has even fuelled concerns that anthropogenic GHGs could tip the global climate into a permanent hot state (Steffen et al., 2018). However, there is no evidence of such non-linear responses at the global scale in climate projections for the next century, which INDICates a near-linear dependence of global temperature on cumulative GHG emissions (Sections 1.3.5, 5.5 and 7.4.3.1). At the regional scale, abrupt changes and tipping points, such as Amazon rainforest dieback and permafrost collapse, have occurred in projections with Earth System Models (Section 4.7.3; Drijfhout the concept of deep uncertainty are also relevant for risk assessment. whose probability of occurrence is low or not well known on society and ecosystems could be high. To better inform risk considered if they are associated with very large consequences do not necessarily represent the most likely outcome. types of events compared to AR5 (Table 1.1, Section 1.4.4). of high uncertainty, SROCC advanced the treatment of situations et al., 2019). A situation of deep uncertainty exists when experts or models that describe relationships among key driving forces about key variables and parameters; and/or (iii) how to The concept of deep uncertainty can complement the IPCC of risk. et al., 2015; Bathiany et al., 2020). In such simulations, tipping points occur in narrow regions of parameter space (e.g., CO concentration or temperature increase), and for specific climate background states. This makes them difficult to predict using Earth system models (ESMs) relying on parmeterizations of known processes. In some cases, it is possible to detect forthcoming tipping points through time- series analysis that identifies increased sensitivity to perturbations as the tipping point is approached (e.g., ‘critical slowing-down’, Scheffer et al., 2012)."
AR6_WG1_1_24,1,60,"Steps towards an attribution assessment The unambiguous framing of what changes are being attributed et al., 2016; Hansen et al., 2016; Stone et al., 2021), followed by the the development of a hypothesis or theory for the linkage (Cross-Working define the INDICATORs of the observed change or event and note the the compilation of fragmented and distributed observational data, (WGI Section 1.5; e.g., Poloczanska et al., 2013; Ray et al., 2015; Cohen should also be considered (e.g., volcanic eruptions: WGI Section change; this baseline and its associated modifiers – such as agricultural alongside the exposure and vulnerability of people depending on"
