indicators,mea,ipbes,Categories,Subcategories,Categories_2,Subcategories_2,indicators_harmonized,ids
Proportion of population reporting having personally felt discriminated against or harassed in the previous 12 months on the basis of a ground of discrimination prohibited under international human rights law,SDG,1,Human Well-Being,Equity,Governance,Broken Governance,proportion of population reporting having personally felt discriminated against or harassed in the previous 12 months on the basis of a ground of discrimination prohibited under international human rights law,SDG_10_3_1_141
Proportion of population reporting having personally felt discriminated against or harassed in the previous 12 months on the basis of a ground of discrimination prohibited under international human rights law,SDG,1,Human Well-Being,Equity,Governance,Broken Governance,proportion of population reporting having personally felt discriminated against or harassed in the previous 12 months on the basis of a ground of discrimination prohibited under international human rights law,SDG_16_b_1_256
Labour share of GDP,SDG,1,Human Assets,Income,NA,NA,labour share of gross domestic product,SDG_10_4_1_142
Redistributive impact of fiscal policy,SDG,NA,Human Assets,Income,Governance,Legislation/Governance,redistributive impact of fiscal policy,SDG_10_4_2_143
Financial Soundness Indicators,SDG,NA,Governance,Legislation/Governance,NA,NA,financial soundness indicators,SDG_10_5_1_144
Proportion of members and voting rights of developing countries in international organizations,SDG,1,Human Well-Being,Equity,NA,NA,proportion of members and voting rights of developing countries in international organizations,"SDG_10_6_1_145,SDG_16_8_1_251"
Recruitment cost borne by employee as a proportion of monthly income earned in country of destination,SDG,NA,Human Assets,State Of Economy,NA,Income,recruitment cost borne by employee as a proportion of monthly income earned in country of destination,SDG_10_7_1_146
"Number of countries with migration policies that facilitate orderly, safe, regular and responsible migration and mobility of people",SDG,1,Human Well-Being,Equity,NA,NA,"number of countries with migration policies that facilitate orderly, safe, regular and responsible migration and mobility of people",SDG_10_7_2_147
Number of people who died or disappeared in the process of migration towards an international destination,SDG,NA,Governance,Broken Governance,NA,NA,number of people who died or disappeared in the process of migration towards an international destination,SDG_10_7_3_148
"Proportion of the population who are refugees, by country of origin",SDG,1,Knowledge Systems,Information On Society And Socio-Economics,NA,NA,"proportion of the population who are refugees, by country of origin",SDG_10_7_4_149
Proportion of tariff lines applied to imports from least developed countries and developing countries with zero-tariff,SDG,NA,Governance,Legislation/Governance,NA,NA,proportion of tariff lines applied to imports from least developed countries and developing countries with zero-tariff,SDG_10_a_1_150
"Total resource flows for development, by recipient and donor countries and type of flow (e.g. official development assistance, foreign direct investment and other flows)",SDG,1,Governance,National/International Cooperation,NA,NA,"total resource flows for development, by recipient and donor countries and type of flow (e.g. official development assistance, foreign direct investment and other flows)",SDG_10_b_1_151
Remittance costs as a proportion of the amount remitted,SDG,NA,Human Assets,Income,NA,State Of Economy,remittance costs as a proportion of the amount remitted,SDG_10_c_1_152
"Proportion of urban population living in slums, informal settlements or inadequate housing",SDG,NA,Human Assets,Coverage Of Basic Needs,Governance,Broken Governance,"proportion of urban population living in slums, informal settlements or inadequate housing",SDG_11_1_1_153
"Proportion of population that has convenient access to public transport, by sex, age and persons with disabilities",SDG,NA,Human Assets,Infrastructure (Build-Up Area),NA,Coverage Of Basic Needs,"proportion of population that has convenient access to public transport, by sex, age and persons with disabilities",SDG_11_2_1_154
Ratio of land consumption rate to population growth rate,SDG,1,Ecosystem Services,Nature Contribution,Human Assets,Coverage Of Basic Needs,ratio of land consumption rate to population growth rate,SDG_11_3_1_155
Proportion of cities with a direct participation structure of civil society in urban planning and management that operate regularly and democratically,SDG,NA,Human Assets,Infrastructure (Build-Up Area),Human Well-Being,Equity,proportion of cities with a direct participation structure of civil society in urban planning and management that operate regularly and democratically,SDG_11_3_2_156
"Total per capita expenditure on the preservation, protection and conservation of all cultural and natural heritage, by source of funding (public, private), type of heritage (cultural, natural) and level of government (national, regional, and local/municipal)",SDG,1,Human Assets,State Of Economy,NA,Information On Society And Socio-Economics,"total per capita expenditure on the preservation, protection and conservation of all cultural and natural heritage, by source of funding (public, private), type of heritage (cultural, natural) and level of government (national, regional, and local/municipal)",SDG_11_4_1_157
"(a) Damage to critical infrastructure and (b) number of disruptions to basic services, attributed to disasters",SDG,NA,Human Assets,Infrastructure (Build-Up Area),Knowledge Systems,Information On Society And Socio-Economics,damage to critical infrastructure,"SDG_11_5_3_a_160,SDG_11_5_3_b_161"
"Proportion of municipal solid waste collected and managed in controlled facilities out of total municipal waste generated, by cities",SDG,NA,Human Assets,Infrastructure (Build-Up Area),NA,NA,"proportion of municipal solid waste collected and managed in controlled facilities out of total municipal waste generated, by cities",SDG_11_6_1_162
"Average share of the built-up area of cities that is open space for public use for all, by sex, age and persons with disabilities",SDG,NA,Human Assets,Infrastructure (Build-Up Area),NA,NA,"average share of the built-up area of cities that is open space for public use for all, by sex, age and persons with disabilities",SDG_11_7_1_164
"Proportion of persons victim of physical or sexual harassment, by sex, age, disability status and place of occurrence, in the previous 12 months",SDG,1,Governance,Broken Governance,NA,NA,"proportion of persons victim of physical or sexual harassment, by sex, age, disability status and place of occurrence, in the previous 12 months",SDG_11_7_2_165
Number of countries that have national urban policies or regional development plans that (a) respond to population dynamics; (b) ensure balanced territorial development; and (c) increase local fiscal space,SDG,1,Governance,Legislation/Governance,NA,NA,number of countries that have national urban policies or regional development plans that respond to population dynamics,"SDG_11_a_1_a_166,SDG_11_a_1_b_167,SDG_11_a_1_c_168"
"Number of countries developing, adopting or implementing policy instruments aimed at supporting the shift to sustainable consumption and production",SDG,1,Governance,Nature-Based Legislation,NA,NA,"number of countries developing, adopting or implementing policy instruments aimed at supporting the shift to sustainable consumption and production",SDG_12_1_1_172
"Number of parties to international multilateral environmental agreements on hazardous waste, and other chemicals that meet their commitments and obligations in transmitting information as required by each relevant agreement",SDG,NA,Governance,Nature-Based Legislation,NA,NA,"number of parties to international multilateral environmental agreements on hazardous waste, and other chemicals that meet their commitments and obligations in transmitting information as required by each relevant agreement",SDG_12_4_1_177
"(a) Hazardous waste generated per capita; and (b) proportion of hazardous waste treated, by type of treatment",SDG,1,Direct Drivers,Pollution,NA,NA,hazardous waste generated per capita,"SDG_12_4_2_a_178,SDG_12_4_2_b_179"
"National recycling rate, tons of material recycled",SDG,1,Governance,Nature-Based Legislation,NA,NA,"national recycling rate, tons of material recycled",SDG_12_5_1_180
Number of countries implementing sustainable public procurement policies and action plans3,SDG,NA,Governance,Nature-Based Legislation,NA,NA,number of countries implementing sustainable public procurement policies and action plans,SDG_12_7_1_182
Implementation of standard accounting tools to monitor the economic and environmental aspects of tourism sustainability,SDG,1,Governance,Legislation/Governance,NA,NA,implementation of standard accounting tools to monitor the economic and environmental aspects of tourism sustainability,SDG_12_b_1_188
"Number of countries with nationally determined contributions, long-term strategies, national adaptation plans and adaptation communications, as reported to the secretariat of the United Nations Framework Convention on Climate Change",SDG,1,Governance,Nature-Based Legislation,NA,NA,"number of countries with nationally determined contributions, long-term strategies, national adaptation plans and adaptation communications, as reported to the secretariat of the united nations framework convention on climate change",SDG_13_2_1_193
Total greenhouse gas emissions per year,SDG,1,Direct Drivers,Climate Change,NA,NA,total greenhouse gas emissions per year,SDG_13_2_2_194
Amounts provided and mobilized in United States dollars per year in relation to the continued existing collective mobilization goal of the $100 billion commitment through to 2025,SDG,1,Human Assets,State Of Economy,NA,NA,amounts provided and mobilized in united states dollars per year in relation to the continued existing collective mobilization goal of the $100 billion commitment through to 2025,SDG_13_a_1_199
Number of countries using ecosystem-based approaches to managing marine areas,SDG,1,Governance,Nature-Based Legislation,NA,NA,number of countries using ecosystem-based approaches to managing marine areas,SDG_14_2_1_203
Average marine acidity (pH) measured at agreed suite of representative sampling stations,SDG,1,Ecosystems,State Of Ecosystems (Marine),Direct Drivers,Climate Change,average marine acidity (ph) measured at agreed suite of representative sampling stations,SDG_14_3_1_204
Coverage of protected areas in relation to marine areas,SDG,1,Ecosystems,Area Conservation,NA,NA,coverage of protected areas in relation to marine areas,SDG_14_5_1_206
"Sustainable fisheries as a proportion of GDP in small island developing States, least developed countries and all countries",SDG,1,Ecosystem Services,Specific Monetary Valuation Of Nature Contribution,Governance,Nature-Based Legislation,"sustainable fisheries as a proportion of gross domestic product in small island developing states, least developed countries and all countries",SDG_14_7_1_208
Degree of application of a legal/regulatory/ policy/institutional framework which recognizes and protects access rights for small-scale fisheries,SDG,1,Governance,Nature-Based Legislation,Ecosystem Services,Specific Mention Of Sustainable Use Of Species/Ecosystems,degree of application of a legal/regulatory/ policy/institutional framework which recognizes and protects access rights for small-scale fisheries,SDG_14_b_1_210
"Number of countries making progress in ratifying, accepting and implementing through legal, policy and institutional frameworks, ocean-related instruments that implement international law, as reflected in the United Nations Convention on the Law of the Sea, for the conservation and sustainable use of the oceans and their resources",SDG,1,Governance,Nature-Based Legislation,NA,NA,"number of countries making progress in ratifying, accepting and implementing through legal, policy and institutional frameworks, ocean-related instruments that implement international law, as reflected in the united nations convention on the law of the sea, for the conservation and sustainable use of the oceans and their resources",SDG_14_c_1_211
"Proportion of important sites for terrestrial and freshwater biodiversity that are covered by protected areas, by ecosystem type",SDG,1,Ecosystems,Area Conservation,NA,NA,"proportion of important sites for terrestrial and freshwater biodiversity that are covered by protected areas, by ecosystem type",SDG_15_1_2_213
Coverage by protected areas of important sites for mountain biodiversity,SDG,1,Ecosystems,Area Conservation,NA,NA,coverage by protected areas of important sites for mountain biodiversity,SDG_15_4_1_216
Proportion of traded wildlife that was poached or illicitly trafficked,SDG,1,Direct Drivers,Specific Mention Of Over-Exploitation And Unsustainable Use Of Species/Ecosystems,NA,NA,proportion of traded wildlife that was poached or illicitly trafficked,"SDG_15_7_1_220,SDG_15_c_1_228"
Proportion of countries adopting relevant national legislation and adequately resourcing the prevention or control of invasive alien species,SDG,1,Governance,Nature-Based Legislation,NA,NA,proportion of countries adopting relevant national legislation and adequately resourcing the prevention or control of invasive alien species,SDG_15_8_1_221
(a) Official development assistance on conservation and sustainable use of biodiversity; and (b) revenue generated and finance mobilized from biodiversity-relevant economic instruments,SDG,1,Governance,Nature-Based Legislation,NA,NA,official development assistance on conservation and sustainable use of biodiversity,"SDG_15_a_1_a_224,SDG_15_b_1_a_226,SDG_15_a_1_b_225,SDG_15_b_1_b_227"
"Number of victims of intentional homicide per 100,000 population, by sex and age",SDG,NA,Human Assets,Information On Society And Socio-Economics,Governance,Broken Governance,"number of victims of intentional homicide per 100,000 population, by sex and age",SDG_16_1_1_229
"Conflict-related deaths per 100,000 population, by sex, age and cause",SDG,NA,Human Assets,Information On Society And Socio-Economics,Governance,Broken Governance,"conflict-related deaths per 100,000 population, by sex, age and cause",SDG_16_1_2_230
"Proportion of population subjected to (a) physical violence, (b) psychological violence and (c) sexual violence in the previous 12 months",SDG,NA,Human Assets,Information On Society And Socio-Economics,Governance,Broken Governance,proportion of population subjected to physical violence in the previous 12 months,"SDG_16_1_3_a_231,SDG_16_1_3_b_232,SDG_16_1_3_c_233"
Proportion of population that feel safe walking alone around the area they live after dark,SDG,NA,Human Well-Being,Equity,Knowledge Systems,Information On Society And Socio-Economics,proportion of population that feel safe walking alone around the area they live after dark,SDG_16_1_4_234
Proportion of children aged 1–17 years who experienced any physical punishment and/or psychological aggression by caregivers in the past month,SDG,NA,Human Assets,Information On Society And Socio-Economics,Governance,Broken Governance,proportion of children aged 1-17 years who experienced any physical punishment and/or psychological aggression by caregivers in the past month,SDG_16_2_1_235
"Number of victims of human trafficking per 100,000 population, by sex, age and form of exploitation",SDG,NA,Human Assets,Information On Society And Socio-Economics,Governance,Broken Governance,"number of victims of human trafficking per 100,000 population, by sex, age and form of exploitation",SDG_16_2_2_236
Proportion of young women and men aged 18–29 years who experienced sexual violence by age 18,SDG,NA,Human Assets,Information On Society And Socio-Economics,Governance,Broken Governance,proportion of young women and men aged 18-29 years who experienced sexual violence by age 18,SDG_16_2_3_237
Proportion of victims of violence in the previous 12 months who reported their victimization to competent authorities or other officially recognized conflict resolution mechanisms,SDG,NA,Human Well-Being,Wellness,Governance,Broken Governance,proportion of victims of violence in the previous 12 months who reported their victimization to competent authorities or other officially recognized conflict resolution mechanisms,SDG_16_3_1_238
Unsentenced detainees as a proportion of overall prison population,SDG,NA,Governance,Broken Governance,Knowledge Systems,Information On Society And Socio-Economics,unsentenced detainees as a proportion of overall prison population,SDG_16_3_2_239
"Proportion of the population who have experienced a dispute in the past two years and who accessed a formal or informal dispute resolution mechanism, by type of mechanism",SDG,NA,Knowledge Systems,Information On Society And Socio-Economics,Governance,Legislation/Governance,"proportion of the population who have experienced a dispute in the past two years and who accessed a formal or informal dispute resolution mechanism, by type of mechanism",SDG_16_3_3_240
Total value of inward and outward illicit financial flows (in current United States dollars),SDG,NA,Human Assets,State Of Economy,Governance,Broken Governance,total value of inward and outward illicit financial flows (in current united states dollars),SDG_16_4_1_241
"Proportion of seized, found or surrendered arms whose illicit origin or context has been traced or established by a competent authority in line with international instruments",SDG,NA,Governance,Legislation/Governance,NA,NA,"proportion of seized, found or surrendered arms whose illicit origin or context has been traced or established by a competent authority in line with international instruments",SDG_16_4_2_242
"Proportion of persons who had at least one contact with a public official and who paid a bribe to a public official, or were asked for a bribe by those public officials, during the previous 12 months",SDG,NA,Human Assets,Information On Society And Socio-Economics,Human Well-Being,Wellness,"proportion of persons who had at least one contact with a public official and who paid a bribe to a public official, or were asked for a bribe by those public officials, during the previous 12 months",SDG_16_5_1_243
"Proportion of businesses that had at least one contact with a public official and that paid a bribe to a public official, or were asked for a bribe by those public officials during the previous 12 months",SDG,NA,Human Assets,Information On Society And Socio-Economics,Governance,Broken Governance,"proportion of businesses that had at least one contact with a public official and that paid a bribe to a public official, or were asked for a bribe by those public officials during the previous 12 months",SDG_16_5_2_244
"Primary government expenditures as a proportion of original approved budget, by sector (or by budget codes or similar)",SDG,NA,Human Assets,State Of Economy,Governance,Legislation/Governance,"primary government expenditures as a proportion of original approved budget, by sector (or by budget codes or similar)",SDG_16_6_1_245
Proportion of population satisfied with their last experience of public services,SDG,NA,Knowledge Systems,Information On Society And Socio-Economics,NA,NA,proportion of population satisfied with their last experience of public services,SDG_16_6_2_246
"Proportion of children under 5 years of age whose births have been registered with a civil authority, by age",SDG,NA,Human Assets,Information On Society And Socio-Economics,Knowledge Systems,Information On Society And Socio-Economics,"proportion of children under 5 years of age whose births have been registered with a civil authority, by age",SDG_16_9_1_252
"Number of verified cases of killing, kidnapping, enforced disappearance, arbitrary detention and torture of journalists, associated media personnel, trade unionists and human rights advocates in the previous 12 months",SDG,NA,Human Assets,Information On Society And Socio-Economics,Governance,Broken Governance,"number of verified cases of killing, kidnapping, enforced disappearance, arbitrary detention and torture of journalists, associated media personnel, trade unionists and human rights advocates in the previous 12 months",SDG_16_10_1_253
"Number of countries that adopt and implement constitutional, statutory and/or policy guarantees for public access to information",SDG,NA,Human Well-Being,Equity,NA,NA,"number of countries that adopt and implement constitutional, statutory and/or policy guarantees for public access to information",SDG_16_10_2_254
Existence of independent national human rights institutions in compliance with the Paris Principles,SDG,NA,Human Well-Being,Equity,NA,NA,existence of independent national human rights institutions in compliance with the paris principles,SDG_16_a_1_255
"Total government revenue as a proportion of GDP, by source",SDG,1,Human Assets,Information On Society And Socio-Economics,NA,NA,"total government revenue as a proportion of gross domestic product, by source",SDG_17_1_1_257
Proportion of domestic budget funded by domestic taxes,SDG,1,Human Assets,State Of Economy,NA,NA,proportion of domestic budget funded by domestic taxes,SDG_17_1_2_258
"Net official development assistance, total and to least developed countries, as a proportion of the Organization for Economic Cooperation and Development (OECD) Development Assistance Committee donors’ gross national income (GNI)",SDG,1,Governance,National/International Cooperation,NA,NA,"net official development assistance, total and to least developed countries, as a proportion of the organization for economic cooperation and development (oecd) development assistance committee donors’ gross national income (gni)",SDG_17_2_1_259
Additional financial resources mobilized for developing countries from multiple sources,SDG,NA,Human Assets,Information On Society And Socio-Economics,NA,NA,additional financial resources mobilized for developing countries from multiple sources,SDG_17_3_1_260
Volume of remittances (in United States dollars) as a proportion of total GDP,SDG,1,Human Assets,Information On Society And Socio-Economics,NA,NA,volume of remittances (in united states dollars) as a proportion of total gross domestic product,SDG_17_3_2_261
Debt service as a proportion of exports of goods and services,SDG,NA,Human Assets,State Of Economy,NA,NA,debt service as a proportion of exports of goods and services,SDG_17_4_1_262
"Number of countries that adopt and implement investment promotion regimes for developing countries, including the least developed countries",SDG,1,Governance,National/International Cooperation,NA,NA,"number of countries that adopt and implement investment promotion regimes for developing countries, including the least developed countries",SDG_17_5_1_263
"Fixed Internet broadband subscriptions per 100 inhabitants, by speed6",SDG,NA,Knowledge Systems,Information On Society And Socio-Economics,NA,NA,"fixed internet broadband subscriptions per 100 inhabitants, by speed6",SDG_17_6_1_264
Proportion of individuals using the Internet,SDG,1,Knowledge Systems,Information On Society And Socio-Economics,NA,NA,proportion of individuals using the internet,SDG_17_8_1_266
"Dollar value of financial and technical assistance (including through North-South, South‑South and triangular cooperation) committed to developing countries",SDG,1,Governance,National/International Cooperation,NA,NA,"dollar value of financial and technical assistance (including through north-south, south‑south and triangular cooperation) committed to developing countries",SDG_17_9_1_267
Worldwide weighted tariff-average,SDG,1,Ecosystem Services,Specific Monetary Valuation Of Nature Contribution,NA,NA,worldwide weighted tariff-average,SDG_17_10_1 _268
Developing countries’ and least developed countries’ share of global exports,SDG,1,Human Assets,State Of Economy,NA,NA,developing countries’ and least developed countries’ share of global exports,SDG_17_11_1_269
"Weighted average tariffs faced by developing countries, least developed countries and small island developing States",SDG,1,Governance,Legislation/Governance,NA,NA,"weighted average tariffs faced by developing countries, least developed countries and small island developing states",SDG_17_12_1_270
Macroeconomic Dashboard,SDG,NA,Human Assets,State Of Economy,NA,NA,macroeconomic dashboard,SDG_17_13_1_271
Number of countries with mechanisms in place to enhance policy coherence of sustainable development,SDG,1,Governance,Nature-Based Legislation,NA,NA,number of countries with mechanisms in place to enhance policy coherence of sustainable development,SDG_17_14_1_272
Extent of use of country-owned results frameworks and planning tools by providers of development cooperation,SDG,1,Governance,Legislation/Governance,NA,NA,extent of use of country-owned results frameworks and planning tools by providers of development cooperation,SDG_17_15_1_273
Number of countries reporting progress in multi-stakeholder development effectiveness monitoring frameworks that support the achievement of the sustainable development goals,SDG,1,Governance,Nature-Based Legislation,NA,NA,number of countries reporting progress in multi-stakeholder development effectiveness monitoring frameworks that support the achievement of the sustainable development goals,SDG_17_16_1_274
Amount in United States dollars committed to public-private partnerships for infrastructure,SDG,1,Human Assets,Infrastructure (Build-Up Area),NA,NA,amount in united states dollars committed to public-private partnerships for infrastructure,SDG_17_17_1_275
