indicators,mea,ipbes,Categories,Subcategories,Categories_2,Subcategories_2,indicators_harmonized,ids
"Trends in abundance, temporal occurrence, and spatial distribution of non-indigenous species, particularly invasive, non-indigenous species, notably in risk areas (in relation to the main vectors and pathways of spreading of such species)",GBF,NA,Biodiversity,State Of Biodiversity,Direct Drivers,Invasive Alien Species,"trends in abundance, temporal occurrence, and spatial distribution of non-indigenous species, particularly invasive, non-indigenous species, notably in risk areas (in relation to the main vectors and pathways of spreading of such species)",GBF_CY_T6_289
Red List Index (impacts of invasive alien species),GBF,1,Biodiversity,State Of Biodiversity,Direct Drivers,Invasive Alien Species,red list index (impacts of invasive alien species),GBF_CY_T6_290
Trends in Loss of Reactive Nitrogen to the Environment.,GBF,NA,Direct Drivers,Pollution,NA,NA,trends in loss of reactive nitrogen to the environment,GBF_CY_T7_291
Trends in Nitrogen Deposition,GBF,1,Direct Drivers,Pollution,NA,NA,trends in nitrogen deposition,GBF_CY_T7_292
Municipal solid waste collected and managed,GBF,NA,Governance,Legislation/Governance,NA,NA,municipal solid waste collected and managed,GBF_CY_T7_293
Hazardous waste generation,GBF,NA,Direct Drivers,Specific Mention Of Over-Exploitation And Unsustainable Use Of Species/Ecosystems,NA,NA,hazardous waste generation,GBF_CY_T7_294
Trends in the amount of litter in the water column including microplastics and on the seafloor,GBF,NA,Direct Drivers,Pollution,NA,NA,trends in the amount of litter in the water column including microplastics and on the seafloor,GBF_CY_T7_295
Underwater noise pollution,GBF,NA,Direct Drivers,Pollution,NA,NA,underwater noise pollution,GBF_CY_T7_299
"Name, amount/ volume/ concentration of highly hazardous pesticides by type (per land/marine area)",GBF,NA,Direct Drivers,Pollution,NA,NA,"name, amount/ volume/ concentration of highly hazardous pesticides by type (per land/marine area)",GBF_CY_T7_300
Pesticide use per area of cropland,GBF,NA,Direct Drivers,Pollution,NA,NA,pesticide use per area of cropland,GBF_CY_T7_301
Above-ground biomass stock in forest (tonnes/ha),GBF,NA,Ecosystems,State Of Ecosystems (Coverage),NA,NA,above-ground biomass stock in forest,GBF_CY_T8_302
Proportion of local governments that adopt and implement local disaster risk reduction strategies in line with national disaster risk reduction strategies,"GBF,SDG",1,Governance,Legislation/Governance,NA,NA,proportion of local governments that adopt and implement local disaster risk reduction strategies in line with national disaster risk reduction strategies,"GBF_CY_T8_304,SDG_1_5_4_11,SDG_11_b_2_170,SDG_13_1_3_192"
"Number of least developed countries and small island developing States with nationally determined contributions, long-term strategies, national adaptation plans, strategies as reported in adaptation communications and national communications",GBF,1,Governance,Nature-Based Legislation,NA,NA,"number of least developed countries and small island developing states with nationally determined contributions, long-term strategies, national adaptation plans and adaptation communications, as reported to the secretariat of the united nations framework convention on climate change",GBF_CY_T8_305
"Number of least developed countries and small island developing States with nationally determined contributions, long-term strategies, national adaptation plans and adaptation communications, as reported to the secretariat of the United Nations Framework Convention on Climate Change",SDG,1,Governance,Nature-Based Legislation,NA,NA,"number of least developed countries and small island developing states with nationally determined contributions, long-term strategies, national adaptation plans and adaptation communications, as reported to the secretariat of the united nations framework convention on climate change",SDG_13_b_1_200
"Carbon stocks and annual net GHG emissions, by landuse category, split by natural and non-natural land cover",GBF,NA,Direct Drivers,Climate Change,NA,NA,"carbon stocks and annual net ghg emissions, by landuse category, split by natural and non-natural land cover",GBF_CY_T8_307
Spawning stock biomass (related to commercially exploited species),GBF,NA,Ecosystem Services,Nature Contribution,Biodiversity,State Of Biodiversity,spawning stock biomass (related to commercially exploited species),GBF_CY_T9_311
Volume of production per labour unit by classes of farming/pastoral/ forestry enterprise size,GBF,1,Human Assets,State Of Economy,NA,NA,volume of production per labour unit by classes of farming/pastoral/forestry enterprise size,GBF_CY_T9_313
Volume of production per labour unit by classes of farming/pastoral/forestry enterprise size,SDG,1,Human Assets,State Of Economy,NA,NA,volume of production per labour unit by classes of farming/pastoral/forestry enterprise size,SDG_2_3_1_20
Agrobiodiversity Index,GBF,NA,Ecosystem Services,Nature Contribution,Biodiversity,State Of Biodiversity,agrobiodiversity index,GBF_CY_T10_314
Changes in soil organic carbon stocks,GBF,NA,Ecosystems,Abiotic Conditions,Ecosystem Services,Nature Contribution,soil organic carbon (soc) stocks,GBF_CY_T10_315
"Trends in carbon stocks (above and below ground), which is currently represented by soil organic carbon (SOC) stocks",UNCCD,NA,Ecosystems,Abiotic Conditions,Ecosystem Services,Nature Contribution,soil organic carbon (soc) stocks,UNCCD_1_3_4
Proportion of land that is degraded over total land area,"GBF,SDG,UNCCD",1,Direct Drivers,Land Conversion,NA,NA,proportion of land that is degraded over total land area,"GBF_CY_T10_319,SDG_15_3_1_215,UNCCD_1_1"
Air emission accounts,GBF,NA,Direct Drivers,Climate Change,NA,NA,air emission accounts,GBF_CY_T11_320
Proportion of local administrative units with established and operational policies and procedures for participation of local communities in water and sanitation management,"GBF,SDG",1,Governance,Legislation/Governance,NA,NA,proportion of local administrative units with established and operational policies and procedures for participation of local communities in water and sanitation management,"GBF_CY_T11_321,SDG_6_b_1_103"
Proportion of population using safely managed drinking water services,"GBF,SDG",1,Human Assets,Coverage Of Basic Needs,NA,Information On Society And Socio-Economics,proportion of population using safely managed drinking water services,"GBF_CY_T11_322,SDG_6_1_1_92"
Mortality rate attributed to household and ambient air pollution,"GBF,SDG",NA,Human Well-Being,Healthy Living Conditions,Direct Drivers,Pollution,mortality rate attributed to household and ambient air pollution,"GBF_CY_T11_323,SDG_3_9_1_48"
Total number of transfers of crop material from the Multilateral System of the International Treaty on Plant Genetic Resources for Food and Agriculture (ITPGRFA) received in a country,GBF,NA,Knowledge Systems,Information On Biodiversity,Biodiversity,Genetic Resources,total number of transfers of crop material from the multilateral system of the international treaty on plant genetic resources for food and agriculture (itpgrfa) received in a country,GBF_CY_T13_325
"Total number of permits, or their equivalent, granted for access to genetic resources",GBF,NA,Governance,Nature-Based Legislation,Biodiversity,Genetic Resources,"total number of permits, or their equivalent, granted for access to genetic resources",GBF_CY_T13_326
"Number of countries that require prior informed consent that have published legislative, administrative or policy measures on access and benefit-sharing in the ABS Clearing-House",GBF,NA,Governance,Nature-Based Legislation,NA,NA,"number of countries that require prior informed consent that have published legislative, administrative or policy measures on access and benefit-sharing in the abs clearing-house",GBF_CY_T13_328
Number of countries that require prior informed consent that have published information on ABS procedures in the ABS Clearing-House,GBF,NA,Governance,Nature-Based Legislation,NA,NA,number of countries that require prior informed consent that have published information on abs procedures in the abs clearing-house,GBF_CY_T13_329
"Number of countries that have adopted legislative, administrative and policy frameworks to ensure fair and equitable sharing of benefits","GBF,SDG",1,Human Well-Being,Equity,NA,NA,"number of countries that have adopted legislative, administrative and policy frameworks to ensure fair and equitable sharing of benefits","GBF_CY_T13_330,SDG_15_6_1_219"
Estimated percentage of monetary and nonmonetary benefits directed towards conservation and sustainable use of biodiversity,GBF,NA,Governance,Nature-Based Funding,Biodiversity,Species Conservation,estimated percentage of monetary and non-monetary benefits directed towards conservation and sustainable use of biodiversity,GBF_CY_T13_331
Human Appropriation of Net Primary Production (HANPP),GBF,1,Ecosystems,State Of Ecosystems (Coverage),Direct Drivers,Land Conversion,human appropriation of net primary productivity,GBF_CY_T14_332
CO2 emission per unit of value added,"GBF,SDG",1,Direct Drivers,Climate Change,NA,NA,co2 emission per unit of value added,"GBF_CY_T14_333,SDG_9_4_1_133"
Change in water-use efficiency over time,"GBF,SDG",1,Human Assets,Infrastructure (Build-Up Area),NA,NA,change in water-use efficiency over time,"GBF_CY_T14_334,SDG_6_4_1_97"
Number of companies publishing sustainability reports,"GBF,SDG",1,Knowledge Systems,Information On Society And Socio-Economics,NA,NA,number of companies publishing sustainability reports,"GBF_CY_T15_336,SDG_12_6_1_181"
Recycling rate,GBF,NA,Knowledge Systems,Information On Society And Socio-Economics,NA,NA,recycling rate,GBF_CY_T16_341
Life cycle Impact assessment (LCIA) e.g. LIME ; Lifecycle Impact Assessment Method based on Endpoint Modelling,GBF,NA,Knowledge Systems,Information On Society And Socio-Economics,NA,NA,life cycle impact assessment (lcia),GBF_CY_T16_342
Levels of poverty in developing communities,GBF,NA,Human Assets,Income,NA,State Of Economy,levels of poverty in developing communities,GBF_CY_T16_343
Number of countries that have the necessary biosafety legal and administrative measures in place,GBF,NA,Governance,Nature-Based Legislation,NA,NA,number of countries that have the necessary biosafety legal and administrative measures in place,GBF_CY_T17_344
Number of countries that implement their biosafety measures,GBF,NA,Governance,Nature-Based Legislation,NA,NA,number of countries that implement their biosafety measures,GBF_CY_T17_345
Number of countries that have the necessary measures and means for detection and identification of products of biotechnology,GBF,NA,Governance,Nature-Based Legislation,NA,NA,number of countries that have the necessary measures and means for detection and identification of products of biotechnology,GBF_CY_T17_346
Number of countries that carry out scientifically sound risk assessments to support biosafety decision-making,GBF,NA,Governance,Nature-Based Legislation,NA,NA,number of countries that carry out scientifically sound risk assessments to support biosafety decision-making,GBF_CY_T17_347
Number of countries that establish and implement risk management measures,GBF,NA,Governance,Nature-Based Legislation,NA,NA,number of countries that establish and implement risk management measures,"GBF_CY_T17_348,GBF_CY_T17_353"
Percentage of Parties to the Cartagena Protocol on Biosafety implementing the relevant provisions of the Protocol,GBF,NA,Governance,Nature-Based Legislation,NA,NA,percentage of parties to the cartagena protocol on biosafety implementing the relevant provisions of the protocol,GBF_CY_T17_349
Number of countries with legal and technical measures for restoration and compensation,GBF,NA,Governance,Nature-Based Funding,NA,NA,number of countries with legal and technical measures for restoration and compensation,GBF_CY_T17_350
Percentage of Parties to the Nagoya - Kuala Lumpur Supplementary Protocol,GBF,NA,Governance,Nature-Based Legislation,NA,NA,percentage of parties to the nagoya - kuala lumpur supplementary protocol,GBF_CY_T17_351
Percentage of countries with systems in place for restoration and compensation of damage to conservation and sustainable use of biological diversity,GBF,NA,Governance,Nature-Based Legislation,NA,NA,percentage of countries with systems in place for restoration and compensation of damage to conservation and sustainable use of biological diversity,GBF_CY_T17_352
Number of countries with mechanisms to facilitate the sharing of and access to information on potential adverse impacts of biotechnology on biodiversity and human health,GBF,NA,Governance,Nature-Based Legislation,NA,NA,number of countries with mechanisms to facilitate the sharing of and access to information on potential adverse impacts of biotechnology on biodiversity and human health,GBF_CY_T17_354
Number of countries with biodiversity-relevant taxes,GBF,NA,Governance,Nature-Based Funding,NA,NA,number of countries with biodiversity-relevant taxes,GBF_CY_T18_355
Number of countries with biodiversity-relevant charges and fees,GBF,NA,Governance,Nature-Based Funding,NA,NA,number of countries with biodiversity-relevant charges and fees,GBF_CY_T18_356
Number of countries with biodiversity-relevant tradable permit schemes,GBF,NA,Governance,Nature-Based Legislation,NA,NA,number of countries with biodiversity-relevant tradable permit schemes,GBF_CY_T18_357
Trends in potentially environmentally harmful elements of government support to agriculture (producer support estimate),GBF,NA,Governance,Nature Detrimental Legislation,NA,NA,trends in potentially environmentally harmful elements of government support to agriculture (producer support estimate),GBF_CY_T18_358
Trends in the number and value of government fossil fuel support measures,GBF,NA,Governance,Nature Detrimental Legislation,NA,NA,trends in the number and value of government fossil-fuel support measures,GBF_CY_T18_359
Amount of fossil-fuel subsidies per unit of GDP (production and consumption),GBF,1,Governance,Nature Detrimental Legislation,NA,NA,amount of fossil-fuel subsidies per unit of gross domestic product (production and consumption),GBF_CY_T18_360
Amount of fossil-fuel subsidies (production and consumption) per unit of GDP,SDG,1,Governance,Nature Detrimental Legislation,NA,NA,amount of fossil-fuel subsidies per unit of gross domestic product (production and consumption),SDG_12_c_1_189
Amount of funding provided through the Global Environment Facility and allocated to the biodiversity focal area,GBF,NA,Governance,Nature-Based Funding,NA,NA,amount of funding provided through the global environment facility and allocated to the biodiversity focal area,GBF_CY_T19_361
"Foreign direct investment (FDI), official development assistance and South-South cooperation as a proportion of total domestic budget",GBF,1,Human Assets,Information On Society And Socio-Economics,NA,NA,"foreign direct investment (fdi), official development assistance and south-south cooperation as a proportion of total domestic budget",GBF_CY_T19_362
Amount and composition of biodiversity-related finance reported to the OECD Creditor reporting system,GBF,NA,Governance,Nature-Based Legislation,NA,NA,amount and composition of biodiversity-related finance reported to the oecd creditor reporting system,GBF_CY_T19_363
"Dollar value of financial and technical assistance (including through North-South, South-South and triangular cooperation) committed to developing countries",GBF,NA,Governance,National/International Cooperation,NA,NA,"dollar value of financial and technical assistance (including through north-south, south-south and triangular cooperation) committed to developing countries",GBF_CY_T19_364
Dollar value of all resources made available to strengthen statistical capacity in developing countries,"GBF,SDG",1,Governance,National/International Cooperation,NA,NA,dollar value of all resources made available to strengthen statistical capacity in developing countries,"GBF_CY_T19_365,SDG_17_19_1_279"
Amount of biodiversity-related philanthropic funding,GBF,NA,Governance,Nature-Based Funding,NA,NA,amount of biodiversity-related philanthropic funding,GBF_CY_T19_366
Number of countries (and number of instruments) with payments for ecosystem services (PES) programmes,GBF,NA,Governance,Nature-Based Funding,NA,NA,number of countries (and number of instruments) with payments for ecosystem services (pes) programmes,GBF_CY_T19_369
"Number of countries that have (a) Assessed values of biodiversity, in accordance with the Convention, (b) Identified and reported funding needs, gaps and priorities (c)Developed national financial plans for biodiversity; (d) Been provided with the necessary funding and capacity building to undertake the above activities",GBF,NA,Knowledge Systems,Information On Biodiversity,NA,NA,"number of countries that have assessed values of biodiversity, in accordance with the convention","GBF_CY_T19_370,GBF_CY_T19_371,GBF_CY_T19_372,GBF_CY_T19_373"
Growth in number of records and species in the Living Planet Index database,GBF,NA,Knowledge Systems,Information On Biodiversity,NA,NA,growth in number of records and species in the living planet index database,GBF_CY_T21_375
Growth in species occurrence records accessible through the Global Biodiversity Information Facility,GBF,1,Knowledge Systems,Information On Biodiversity,NA,NA,species occurrence records accessible through the global biodiversity information facility,GBF_CY_T21_376
Growth in marine species occurrence records accessible through OBIS,GBF,NA,Knowledge Systems,Information On Biodiversity,NA,NA,growth in marine species occurrence records accessible through ocean biodiversity information system (obis),GBF_CY_T21_377
Proportion of known species assessed through the IUCN Red List.,GBF,1,Biodiversity,Species Conservation,NA,NA,proportion of known species assessed through the red list index,GBF_CY_T21_378
Number of assessments on the IUCN Red List of threatened species,GBF,NA,Biodiversity,Species Conservation,NA,NA,number of assessments on the red list index,GBF_CY_T21_379
World Association of Zoos and Aquariums (WAZA) bio-literacy survey (Biodiversity literacy in global zoo and aquarium visitors),GBF,NA,Knowledge Systems,Information On Society And Socio-Economics,NA,NA,world association of zoos and aquariums (waza) bio-literacy survey (biodiversity literacy in global zoo and aquarium visitors),GBF_CY_T21_380
"Percentage of positions in national and local institutions, including (a) the legislatures; (b) the public service; and (c) the judiciary, compared to national distributions, by sex, age, persons with disabilities and population groups",GBF,NA,Human Well-Being,Equity,NA,NA,"proportions of positions in national and local institutions, including the legislatures, compared to national distributions, by sex, age, persons with disabilities and population groups","GBF_CY_T22_382,GBF_CY_T23_393,GBF_CY_T22_383,GBF_CY_T23_394,GBF_CY_T22_384,GBF_CY_T23_395"
"Proportions of positions in national and local institutions, including (a) the legislatures; (b) the public service; and (c) the judiciary, compared to national distributions, by sex, age, persons with disabilities and population groups",SDG,NA,Human Well-Being,Equity,NA,NA,"proportions of positions in national and local institutions, including the legislatures, compared to national distributions, by sex, age, persons with disabilities and population groups","SDG_16_7_1_a_247,SDG_16_7_1_b_248,SDG_16_7_1_c_249"
Number of countries with systems to track and make public allocations for gender equality and women's empowerment,GBF,NA,Human Well-Being,Equity,NA,NA,number of countries with systems to track and make public allocations for gender equality and women's empowerment,"GBF_CY_T22_385,GBF_CY_T23_398"
"Proportion of total agricultural population with ownership or secure tenure rights over agricultural land, by sex; and (b) share of women among owners or rights-bearers of agricultural land, by type of tenure",GBF,1,Human Well-Being,Equity,NA,NA,"proportion of total agricultural population with ownership or secure rights over agricultural land, by sex","GBF_CY_T22_386,GBF_CY_T22_387"
"Proportion of total agricultural population with ownership or secure rights over agricultural land, by sex; and (b) share of women among owners or rights-bearers of agricultural land, by type of tenure",GBF,1,Human Well-Being,Equity,NA,NA,"proportion of total agricultural population with ownership or secure rights over agricultural land, by sex","GBF_CY_T23_396,GBF_CY_T23_397"
"(a) Proportion of total agricultural population with ownership or secure rights over agricultural land, by sex; and (b) share of women among owners or rights-bearers of agricultural land, by type of tenure",SDG,1,Human Well-Being,Equity,NA,NA,"proportion of total agricultural population with ownership or secure rights over agricultural land, by sex","SDG_5_a_1_a_87,SDG_5_a_1_b_88"
Number of countries where the legal framework (including customary law) guarantees women's equal rights to land ownership and/or control,GBF,NA,Human Well-Being,Equity,Governance,Legislation/Governance,number of countries where the legal framework (including customary law) guarantees women's equal rights to land ownership and/or control,GBF_CY_T22_388
"Trends in number of environmental human rights defenders killed annually, disaggregated by country, gender; number of indigenous environmental human rights defenders kill",GBF,NA,Governance,Broken Governance,NA,NA,"trends in number of environmental human rights defenders killed annually, disaggregated by country, gender; number of indigenous environmental human rights defenders kill",GBF_CY_T22_390
Land tenure [in the traditional territories] of indigenous peoples and local communities [by sex and type of tenure],GBF,NA,Ecosystems,State Of Ecosystems,Knowledge Systems,Ilk,land tenure [in the traditional territories] of indigenous peoples and local communities [by sex and type of tenure],GBF_CY_T22_391
"Proportion of population who believe decision-making is inclusive and responsive, by sex, age, disability and population group","GBF,SDG",NA,Human Well-Being,Equity,NA,Wellness,"proportion of population who believe decision-making is inclusive and responsive, by sex, age, disability and population group","GBF_CY_T22_392,SDG_16_7_2_250"
"Percentage of population who believe decision making is inclusive and responsive, by sex, age, disability and population group",GBF,NA,Human Well-Being,Equity,NA,Wellness,"percentage of population who believe decision making is inclusive and responsive, by sex, age, disability and population group",GBF_CY_T23_400
Proportion of countries where the legal framework (including customary law) guarantees women's equal rights to land ownership and/or control,GBF,1,Human Well-Being,Equity,NA,NA,proportion of countries where the legal framework (including customary law) guarantees women equal rights to land ownership and/or control,GBF_CY_T23_401
Proportion of countries where the legal framework (including customary law) guarantees women’s equal rights to land ownership and/or control,SDG,1,Human Well-Being,Equity,NA,NA,proportion of countries where the legal framework (including customary law) guarantees women equal rights to land ownership and/or control,SDG_5_a_2_89
"Proportion of the population living below the international poverty line by sex, age, employment status and geographic location (urban/rural)",SDG,1,Knowledge Systems,Information On Society And Socio-Economics,NA,State Of Economy,"proportion of the population living below the international poverty line by sex, age, employment status and geographic location (urban/rural)",SDG_1_1_1_1
"Proportion of population living below the national poverty line, by sex and age",SDG,1,Human Assets,Coverage Of Basic Needs,NA,Income,"proportion of population living below the national poverty line, by sex and age",SDG_1_2_1_2
"Proportion of men, women and children of all ages living in poverty in all its dimensions according to national definitions",SDG,1,Human Well-Being,Equity,NA,NA,"proportion of men, women and children of all ages living in poverty in all its dimensions according to national definitions",SDG_1_2_2_3
"Proportion of population covered by social protection floors/systems, by sex, distinguishing children, unemployed persons, older persons, persons with disabilities, pregnant women, newborns, work-injury victims and the poor and the vulnerable",SDG,NA,Human Well-Being,Equity,NA,NA,"proportion of population covered by social protection floors/systems, by sex, distinguishing children, unemployed persons, older persons, persons with disabilities, pregnant women, newborns, work-injury victims and the poor and the vulnerable",SDG_1_3_1_4
Proportion of population living in households with access to basic services,SDG,1,Human Assets,Coverage Of Basic Needs,NA,NA,proportion of population living in households with access to basic services,SDG_1_4_1_5
Direct economic loss attributed to disasters in relation to global gross domestic product (GDP),SDG,1,Human Assets,State Of Economy,NA,NA,direct economic loss attributed to disasters in relation to global gross domestic product,"SDG_1_5_2_9,SDG_11_5_2_159"
Number of countries that adopt and implement national disaster risk reduction strategies in line with the Sendai Framework for Disaster Risk Reduction 2015–2030,SDG,1,Governance,Nature-Based Legislation,NA,NA,number of countries that adopt and implement national disaster risk reduction strategies in line with the sendai framework for disaster risk reduction 2015-2030,"SDG_1_5_3_10,SDG_11_b_1_169,SDG_13_1_2_191"
