indic_id,indicators_harmonized,ipcc_sup,ga_sup,sua_sup
IPCC_1,monthly maximum value of daily maximum temperature,1,NA,NA
IPCC_2,monthly minimum value of daily maximum temperature,1,NA,NA
IPCC_3,monthly minimum value of daily minimum temperature,1,NA,NA
IPCC_4,monthly maximum value of daily minimum temperature,1,NA,NA
IPCC_5,percentage of days when daily maximum temperature is greater than the 90th percentile,1,NA,NA
IPCC_6,percentage of days when daily maximum temperature is less than the 10th percentile,1,NA,NA
IPCC_7,percentage of days when daily minimum temperature is greater than the 90th percentile,1,NA,NA
IPCC_8,percentage of days when daily minimum temperature is less than the 10th percentile,1,NA,NA
IPCC_9,number of icing days: annual count of days when tx (daily maximum temperature) <0°c,1,NA,NA
IPCC_10,number of frost days: annual count of days when tn (daily minimum temperature) <0°c,1,NA,NA
IPCC_11,warm spell duration index (wsdi),1,NA,NA
IPCC_12,cold spell duration index: annual count of days with at least six consecutive days when tn <10th percentile,1,NA,NA
IPCC_13,number of summer days: annual count of days when tx (daily maximum temperature) >25°c,1,NA,NA
IPCC_14,number of tropical nights: annual count of days when tn (daily minimum temperature) >20°c,1,NA,NA
IPCC_15,daily temperature range: monthly mean difference between tx and tn,1,NA,NA
IPCC_16,"growing season length: annual (1 jan to 31 dec in northern hemisphere (nh), 1 july to 30 june in southern hemisphere (sh)) count between first span of at least six days with daily mean temperature tg >5°c and first span after july 1 (jan 1 in sh) of six days with tg <5°c",1,NA,NA
IPCC_17,one-in-20 year return value of monthly maximum value of daily maximum temperature,1,NA,NA
IPCC_18,one-in-20 year return value of monthly minimum value of daily maximum temperature,1,NA,NA
IPCC_19,one-in-20 year return value of monthly minimum value of daily minimum temperature,1,NA,NA
IPCC_20,one-in-20 year return value of monthly maximum value of daily minimum temperature,1,NA,NA
IPCC_21,maximum one-day precipitation,1,NA,NA
IPCC_22,maximum five-day precipitation,1,NA,NA
IPCC_23,annual count of days when precipitation is greater than or equal to 5 mm,1,NA,NA
IPCC_24,annual count of days when precipitation is greater than or equal to 10 mm,1,NA,NA
IPCC_25,annual count of days when precipitation is greater than or equal to 20 mm,1,NA,NA
IPCC_26,annual count of days when precipitation is greater than or equal to 50 mm,1,NA,NA
IPCC_27,maximum number of consecutive days with less than 1 mm of precipitation per day,1,NA,NA
IPCC_28,maximum number of consecutive days with more than or equal to 1 mm of precipitation per day,1,NA,NA
IPCC_29,annual total precipitation when the daily precipitation exceeds the 95th percentile of the wet-day (>1 mm) precipitation,1,NA,NA
IPCC_30,annual precipitation amount when the daily precipitation exceeds the 99th percentile of the wet-day precipitation,1,NA,NA
IPCC_31,simple precipitation intensity index,1,NA,NA
IPCC_32,one-in-20 year return value of maximum one-day precipitation,1,NA,NA
IPCC_33,one-in-20 year return value of maximum five-day precipitation,1,NA,NA
IPCC_34,standardized precipitation index,1,NA,NA
IPCC_35,"potential evaporation, evaporative demand drought index",1,NA,NA
IPCC_36,soil moisture anomalies,1,NA,NA
IPCC_37,standardized soil moisture index,1,NA,NA
IPCC_38,standardized runoff index,1,NA,NA
IPCC_39,standardized streamflow index,1,NA,NA
IPCC_40,palmer drought severity index (pdsi),1,NA,NA
IPCC_41,standardized precipitation evapotranspiration index (spei),1,NA,NA
NA,gross domestic product,NA,1,NA
NA,globalization index,NA,1,NA
NA,poverty gap,NA,1,NA
NA,food security index,NA,1,NA
NA,depth of the food deficit (kcal/capit a/day) (3- year average),NA,1,NA
NA,access to improved sanitation facilities,NA,1,NA
NA,domestic material consumption,NA,1,NA
NA,per capita calorie intake,NA,1,NA
NA,prevalence of obesity in the adult population (18 years and older),NA,1,NA
NA,energy use (kg of oil equivalent per capita),NA,1,NA
NA,mobile cellular subscriptions,NA,1,NA
NA,fossil-fuel energy consumption (% of total),NA,1,NA
NA,renewable electricity consumption (% of total electricity output),NA,1,NA
NA,electric power consumption (kwh per capita),NA,1,NA
NA,access to electricity,NA,1,NA
NA,alternative and nuclear energy (% of total energy use),NA,1,NA
NA,protein intake per country per person,NA,1,NA
NA,"energy supply derived from cereals, roots and tubers",NA,1,NA
NA,people per ouletlet mcdonals,NA,1,NA
NA,population growth (annual %),NA,1,NA
NA,population density,NA,1,NA
NA,child mortality rate,NA,1,NA
NA,urban population,NA,1,NA
NA,total international migrant stock,NA,1,NA
NA,refugee population,NA,1,NA
NA,migration net,NA,1,NA
NA,population in the largest city,NA,1,NA
NA,population in megacities,NA,1,NA
NA,agricultural land,NA,1,NA
NA,livestock indigenous animals,NA,1,NA
NA,livestock density of cattle,NA,1,NA
NA,livestock density of animals (chickens),NA,1,NA
NA,area of agricultural land under organic production,NA,1,NA
NA,"international tourism, number of departures",NA,1,NA
NA,"international tourism, number of arrivals",NA,1,NA
NA,container port traffic (teu: 20 foot equivalent units),NA,1,NA
NA,air passengers,NA,1,NA
NA,air departures,NA,1,NA
NA,deaths from air pollution,NA,1,NA
NA,ghg emissions,NA,1,NA
NA,pesticide use,NA,1,NA
NA,fertilizers used,NA,1,NA
NA,air pollution,NA,1,NA
NA,nitrogenen deposition trends,NA,1,NA
NA,ghg emissions change,NA,1,NA
NA,extraction ores,NA,1,NA
NA,extraction all of biomass,NA,1,NA
NA,extraction of ind. and const. minerals,NA,1,NA
NA,extraction biomass food,NA,1,NA
NA,extraction biomass forestry,NA,1,NA
NA,extraction biomass feed,NA,1,NA
NA,extraction biomass animals,NA,1,NA
NA,extraction other biomass,NA,1,NA
NA,extraction fossil-fuel,NA,1,NA
NA,water withdrawal,NA,1,NA
NA,renewable internal freshwater resource,NA,1,NA
NA,agricultural water withdrawal,NA,1,NA
NA,ramsar sites,NA,1,NA
NA,certified forest area,NA,1,NA
NA,united nations framework convention on climate change,NA,1,NA
NA,convention of fishing and conservation of the living resources of the high seas,NA,1,NA
NA,montreal protocol,NA,1,NA
NA,convention on biological diversity,NA,1,NA
NA,convention on the conservation of antarctic marine living resources,NA,1,NA
NA,"credit to agriculture, forestry and fishing",NA,1,NA
NA,political stability and absence of violence/terrorism,NA,1,NA
NA,above-ground biomass,NA,1,NA
NA,biodiversity habitat index,NA,1,NA
NA,biodiversity habitat index (hotspots),NA,1,NA
NA,coastal carbon-rich habitat,NA,1,NA
NA,coastal protection habitats,NA,1,NA
NA,forest area,NA,1,NA
NA,extent of intact forest landscapes,NA,1,NA
NA,extent of marine wilderness,NA,1,NA
NA,extent of terrestrial wilderness,NA,1,NA
NA,fraction of ocean not fished per year,NA,1,NA
NA,land not cultivated or urban,NA,1,NA
NA,land not cultivated or urban (hotspots),NA,1,NA
NA,land not cultivated or urban (indigenous lands),NA,1,NA
NA,leaf area index (lai),NA,1,NA
NA,mangrove forest area,NA,1,NA
NA,extent of suitable habitat,NA,1,NA
NA,live coral cover,NA,1,NA
NA,permanent surface water extent,NA,1,NA
NA,remaining primary vegetation,NA,1,NA
NA,remaining primary vegetation (hotspots),NA,1,NA
NA,remaining primary vegetation (indigenous lands),NA,1,NA
NA,seagrass meadow area,NA,1,NA
NA,soil organic carbon (correlative model),NA,1,NA
NA,soil organic carbon (mechanistic models),NA,1,NA
NA,tree cover,NA,1,NA
NA,vegetation biomass (mechanistic models),NA,1,NA
NA,wetland extent trends index,NA,1,NA
NA,biological pump efficiency,NA,1,NA
NA,biomass turnover rate,NA,1,NA
NA,evapotranspiration (model ensemble),NA,1,NA
NA,marine net primary production,NA,1,NA
NA,net primary production remaining in ecosystems,NA,1,NA
NA,oceanic carbon sequestration,NA,1,NA
NA,terrestrial c sequestration (model ensemble),NA,1,NA
NA,terrestrial net primary production (model ensemble),NA,1,NA
NA,terrestrial net primary production (remote-sensing),NA,1,NA
NA,biodiversity intactness index (hotspots),NA,1,NA
NA,biodiversity intactness index (indigenous lands),NA,1,NA
NA,biodiversity intactness index,NA,1,NA
NA,local species richness (biotime),NA,1,NA
NA,local species richness (predicts),NA,1,NA
NA,mean species abundance (msa),NA,1,NA
NA,mean species abundance (msa) (hotspots),NA,1,NA
NA,mean species abundance (msa) (indigenous lands),NA,1,NA
NA,"biodiversity intactness index (tropical forest, hotspots)",NA,1,NA
NA,"biodiversity intactness index (tropical forest, indigenous lands)",NA,1,NA
NA,biodiversity intactness index (tropical forest),NA,1,NA
NA,bird species per grid cell,NA,1,NA
NA,cumulative introduced invasive aliens,NA,1,NA
NA,forest-specialist bird species per grid cell,NA,1,NA
NA,functional intactness (madingley) (madingley),NA,1,NA
NA,species richness per grid cell,NA,1,NA
NA,global bird richness (csar),NA,1,NA
NA,global forest-specialist bird richness (csar),NA,1,NA
NA,global mammal and bird species remaining,NA,1,NA
NA,red list index,NA,1,1
NA,red list index (forest specialists),NA,1,NA
NA,red list index (internationally traded birds),NA,1,NA
NA,red list index (pollinators),NA,1,NA
NA,red list index (for utilized species),NA,1,NA
NA,red list index (wild relatives of farmed and domesticated species),NA,1,NA
NA,extent of suitable habitat (mammals),NA,1,NA
NA,mammalian range size,NA,1,NA
NA,megafaunal range size,NA,1,NA
NA,species habitat index,NA,1,NA
NA,proportion of fish stocks within biologically sustainable levels,NA,1,1
NA,living planet index (freshwater),NA,1,NA
NA,living planet index (marine),NA,1,NA
NA,living planet index,NA,1,NA
NA,living planet index (terrestrial),NA,1,NA
NA,predatory fish biomass,NA,1,NA
NA,prey fish biomass,NA,1,NA
NA,wild bird index (habitat specialists),NA,1,NA
NA,wild mammal biomass,NA,1,NA
NA,functional richness (madingley),NA,1,NA
NA,mammalian body mass,NA,1,NA
NA,marine trophic index (mti),NA,1,NA
NA,extent of each ecoregion globally,NA,1,NA
NA,landscape dominance of habitat,NA,1,NA
NA,number of managed bee hives,NA,1,NA
NA,abundance of managed and wild pollinators,NA,1,NA
NA,pollinator diversity,NA,1,NA
NA,proportion pollinator dependent vegetables/fruit in food supply,NA,1,NA
NA,number of visitors to national parks in the eeuu,NA,1,NA
NA,output from pollinator dependent crops,NA,1,NA
NA,carbon stocks in ecosystems,NA,1,NA
NA,prevented emissions from biofuel use,NA,1,NA
NA,vegetation type and cover in areas prone to soil dust emission,NA,1,NA
NA,leaf properties,NA,1,NA
NA,vegetation type and cover in areas prone to soil dust movement,NA,1,NA
NA,concentration of air pollutants in the air,NA,1,NA
NA,retention and prevented emissions of air pollutants by ecosystems,NA,1,NA
NA,amelioration of health problems caused by air pollution resulted from ecosystem contributions to air quality,NA,1,NA
NA,reduction in the number of deaths caused by air pollution reduction by ecosystems,NA,1,NA
NA,"premature deaths caused by pollution emissions by natural sources, biomass burning, firewood use and agriculture",NA,1,NA
NA,cost reduction with healthcare resulted from ecosystem contributions to air quality,NA,1,NA
NA,cost reduction associated to prevented deaths caused by air pollution as consequence of ecosystems’ deposition of air pollutants,NA,1,NA
NA,vegetation-atmosphere co2 exchange,NA,1,NA
NA,below- and above-ground biomass stocks,NA,1,NA
NA,biomass changes,NA,1,NA
NA,remote sensed vegetation,NA,1,NA
NA,mechanistic models that quantify and disentangle effects of vegetation on climate and hydrological cycle,NA,1,NA
NA,atmospheric sounding,NA,1,NA
NA,infiltrability,NA,1,NA
NA,air temperature low-cost thermal imagery,NA,1,NA
NA,soil organic carbon,NA,1,NA
NA,dust emissions,NA,1,NA
NA,net greenhouse gases emissions,NA,1,NA
NA,air-sea and sediment-water fluxes of carbon and co2,NA,1,NA
NA,air-sea fluxes of other greenhouse gases such as dimethyl sulfide,NA,1,NA
NA,dissolved organic carbon,NA,1,NA
NA,co2 removal from atmosphere,NA,1,NA
NA,net primary production,NA,1,NA
NA,abundance of sulfate reducing microorganisms,NA,1,NA
NA,carbon sequestration,NA,1,NA
NA,concentration of greenhouse gases in the atmosphere,NA,1,NA
NA,prevented emissions and uptake of greenhouse gases by ecosystems,NA,1,NA
NA,number of deaths caused by extreme climatic events,NA,1,NA
NA,food security and climate change,NA,1,NA
NA,number of undernourished people,NA,1,NA
NA,crop production breaks caused by climate change,NA,1,NA
NA,"economic impacts of climate change on specific aspects of regional economic activity, such as labour productivity, the supply of production factors such as capital, and changes in the structure of demand",NA,1,NA
NA,extent of marine vegetation,NA,1,NA
NA,extent of marine calcification,NA,1,NA
NA,net primary production seaweed aquaculture,NA,1,NA
NA,extent of coral reefs,NA,1,NA
NA,land use change that causes a change in et,NA,1,NA
NA,change in terrestrial biomass,NA,1,NA
NA,change in extent of wetlands and inland water bodies,NA,1,NA
NA,"biotic mediation of air-surface-groundwater partitioning (water demand by vegetation, infiltration)",NA,1,NA
NA,water availability,NA,1,NA
NA,water available for people relative to demand,NA,1,NA
NA,extent of irrigated area,NA,1,NA
NA,water shortage,NA,1,NA
NA,desertification,NA,1,NA
NA,how much kw hrs that are dependent on water ag (irrigated area),NA,1,NA
NA,suspended organic carbon,NA,1,NA
NA,existence of non-crop or urban in a place dominated by either,NA,1,NA
NA,capacity of ecosystem to filter (or add) constituent components (extent of vegetation),NA,1,NA
NA,concentration of constituents (pollutants) in the water,NA,1,NA
NA,reduced incidence of water borne disease,NA,1,NA
NA,avoided water treatment costs,NA,1,NA
NA,rain-use efficiency adjusted ndvi,NA,1,NA
NA,crop yield,NA,1,NA
NA,soil depth,NA,1,NA
NA,food security,NA,1,NA
NA,soil biodiversity,NA,1,NA
NA,soil quality,NA,1,NA
NA,soil degradation impact on crop productivity,NA,1,NA
NA,coral reefs distribution and extent,NA,1,NA
NA,mangrove distribution and abundance,NA,1,NA
NA,saltmarsh distribution and abundance,NA,1,NA
NA,coastal forest distribution and extent,NA,1,NA
NA,globally available combined bathy/topo,NA,1,NA
NA,globally available data for waves and wind,NA,1,NA
NA,globally available continental shelf,NA,1,NA
NA,thousands of deaths each year,NA,1,NA
NA,billions of dollars each year,NA,1,NA
NA,fraction of people die due to flood,NA,1,NA
NA,fraction of people infected with disease of flood,NA,1,NA
NA,post-traumatic stress disorder score,NA,1,NA
NA,cumulative exposure indicators,NA,1,NA
NA,psychological health indicators,NA,1,NA
NA,direct tangible damage loss,NA,1,NA
NA,landscape inundated by the flood,NA,1,NA
NA,"absolute damage to roads and transportation, power plant,etc",NA,1,NA
NA,lowered incidence and impact of hazards,NA,1,NA
NA,lowered flood peaks,NA,1,NA
NA,lowered fuel load (fires),NA,1,NA
NA,coastal protection,NA,1,NA
NA,landslides stabilization,NA,1,NA
NA,incidence of hazards,NA,1,NA
NA,reduced morbidity and premature mortality,NA,1,NA
NA,reduced property loss,NA,1,NA
NA,near- or on-farm habitat diversity,NA,1,NA
NA,landscape complexity,NA,1,NA
NA,abundance of alternative hosts species,NA,1,NA
NA,species richness,NA,1,NA
NA,avoided costs of pesticide use,NA,1,NA
NA,avoided costs of health treatment of vbd,NA,1,NA
NA,reduced pesticide use,NA,1,NA
NA,reduced prevalence of vbd,NA,1,NA
NA,diversity of biological controllers of pests,NA,1,NA
NA,diversity of competent hosts of vector-borne and zoonotic diseases,NA,1,NA
NA,abundance of wild and managed biological controllers of pests,NA,1,NA
NA,abundance of competent hosts of vector-born and zoonotic diseases,NA,1,NA
NA,avoided pest damage to crop and livestock,NA,1,NA
NA,reduced incidence rate of vector-borne and zoonotic diseases,NA,1,NA
NA,"tonnage of biomass (sugar cane, corn, palm oil)",NA,1,NA
NA,land area in biomass production,NA,1,NA
NA,tonnage of fuelwood,NA,1,NA
NA,biomass estimates in forests,NA,1,NA
NA,numbers of livestock and use rate,NA,1,NA
NA,"tonnage of biomass (sugar cane, corn, palm oil), other energy crops",NA,1,NA
NA,yield (production) in tonnage,NA,1,NA
NA,biofuel yield in joules or liters,NA,1,NA
NA,"biofuel yield in joules or liters from agricultural/horticultural residue, forestry industry residue, other organic residues or by-products from various industries/process",NA,1,NA
NA,biofuel yield in joules or liters from industrial effluents and/or municipal solid waste,NA,1,NA
NA,biofuel yield joules or liters from algal/microalgae biomass,NA,1,NA
NA,population directly reliant on biomass,NA,1,NA
NA,kwh x price,NA,1,NA
NA,tons of oil equivalent x price,NA,1,NA
NA,land suitability and extent of bioenergy crop and livestock producing and harvesting areas,NA,1,NA
NA,diversity and abundance of species for bioenergy use,NA,1,NA
NA,energy content of bioenergy crops,NA,1,NA
NA,tonnage of animal waste used for energy,NA,1,NA
NA,increased energy security,NA,1,NA
NA,revenue from bioenergy production,NA,1,NA
NA,yield per hectare converted to caloric or nutrient yield,NA,1,NA
NA,agrodiversity and landraces known to date for major crops,NA,1,NA
NA,remote sensing of croplands,NA,1,NA
NA,types of agroecosystems,NA,1,NA
NA,landed catch,NA,1,NA
NA,aquaculture production,NA,1,NA
NA,quantity of fish produced for animal/aquaculture feed,NA,1,NA
NA,mean length of catch,NA,1,NA
NA,large fish indicator,NA,1,NA
NA,trophic level of the landed catch,NA,1,NA
NA,mean length of fish in the community,NA,1,NA
NA,proportion of predatory fish,NA,1,NA
NA,trophic level of the community,NA,1,NA
NA,proportion of non-declining species in the surveyed community,NA,1,NA
NA,change in mean fish size,NA,1,NA
NA,trends in fisheries certified by the msc,NA,1,NA
NA,status of assessed fish stocks,NA,1,NA
NA,indicator of unsustainable fisheries (iuu),NA,1,NA
NA,ocean health index,NA,1,NA
NA,ebfm performance index,NA,1,NA
NA,fisheries management effectiveness index,NA,1,NA
NA,fisheries management index,NA,1,NA
NA,value of production,NA,1,NA
NA,value of catch,NA,1,NA
NA,"nutritional output (calories, nutrients)",NA,1,NA
NA,farm size distribution,NA,1,NA
NA,nutrition derived from fish,NA,1,NA
NA,fisheries revenues,NA,1,NA
NA,gross value added (gva),NA,1,NA
NA,potential catch loss,NA,1,NA
NA,production of fish meal and fish oil use in aquaculture/animal feeds,NA,1,NA
NA,number of jobs,NA,1,NA
NA,arable land remaining,NA,1,NA
NA,fish catch potential,NA,1,NA
NA,kcal capita,NA,1,NA
NA,dietary diversity,NA,1,NA
NA,hunger,NA,1,NA
NA,malnutrition,NA,1,NA
NA,timber harvest (m3/ha/year),NA,1,NA
NA,grass/fodder (kg),NA,1,NA
NA,bamboos and rattans market value,NA,1,NA
NA,market value,NA,1,NA
NA,gums (kg),NA,1,NA
NA,resins (kg),NA,1,NA
NA,latexes (kg),NA,1,NA
NA,oil (kg),NA,1,NA
NA,waxes (kg),NA,1,NA
NA,tannins (kg),NA,1,NA
NA,dyes (kg),NA,1,NA
NA,cork (kg),NA,1,NA
NA,bark (kg),NA,1,NA
NA,cotton (t/ha),NA,1,NA
NA,flax (t/ha/year)),NA,1,NA
NA,jute yields (t/ha/year),NA,1,NA
NA,sisal yields (t/ha/year),NA,1,NA
NA,hemp yields (t/ha/year),NA,1,NA
NA,silk cocoons (t/hear),NA,1,NA
NA,coral solid units (number/year),NA,1,NA
NA,pearls sold units (number/year),NA,1,NA
NA,shell sold units (number/year),NA,1,NA
NA,ornamental plants sold units (number/year or kg/year),NA,1,NA
NA,pet fish sold units (number and species diversity/year),NA,1,NA
NA,pet bird sold units (number and species diversity/year),NA,1,NA
NA,pet reptile sold units (number and species diversity/year),NA,1,NA
NA,pet amphibian sold units (number and species diversity/year),NA,1,NA
NA,"other living organism for assistance number, stock density (number of horse/household)",NA,1,NA
NA,health benefits provide by companion animals,NA,1,NA
NA,"supply of fiber crops, resins, gum arabic",NA,1,NA
NA,trade of silk,NA,1,NA
NA,"production of industrial roundwood, paper pulps",NA,1,NA
NA,export and import of commodity data,NA,1,NA
NA,export and import data,NA,1,NA
NA,number of traded live animals/plants listed in cites databases,NA,1,NA
NA,land suitability and extent of cotton producing area,NA,1,NA
NA,volume of round wood production,NA,1,NA
NA,tonnage of cotton production,NA,1,NA
NA,number of people employed in forest industry,NA,1,NA
NA,"number of people employed in garment industry (include fibre, cotton industry)",NA,1,NA
NA,map of medicinal plants overlaying plant richness at the global level,NA,1,NA
NA,percentage of new drugs discovered over the last 30 years based on natural medicinal products,NA,1,NA
NA,"biodiversity with high potential for having bioactive principles for medicines or represent genetic resources useful for medicines agriculture or other purposes, that have been identified locally through ilk or by other knowledge systems at global levels for health treatments or other purposes (agriculture or other)",NA,1,NA
NA,medicinal plants known to date and accessible for health care as a proxy for all natural medicinal products (national medicines policies),NA,1,NA
NA,genetic resources and especially agrodiversity known to date and its linkage to food security,NA,1,NA
NA,more than 25% of new chemical entities developed for drugs for all diseases treated at the global level over the last 30 years are derived from natural products or chemical leads from national medicines policies and more than 70% of drugs to treat cancers derive directly from national medicines policies,NA,1,NA
NA,percentage of world population relying almost entirely on national medicines policies,NA,1,NA
NA,percentage of modern drugs based on national medicines policies or bio-inspired molecules used for diseases at the global level,NA,1,NA
NA,"percentages of wild plant collection harvested, traded",NA,1,NA
NA,new drugs production and sales,NA,1,NA
NA,maps showing areas where humans mostly rely national medicines policies for health,NA,1,NA
NA,biodiversity intactness index (for plants and vertebrates),NA,1,NA
NA,linguistic diversity index,NA,1,NA
NA,in situ genetic resources of interest to science and ex situ gene banks or genetic and or chemical related informations,NA,1,NA
NA,ability of learning through direct proximity of people with nature in biodiversity-rich landscapes or agroecosystems,NA,1,NA
NA,"elements (parts) of nature used in scientific experiments, from species to genes and their continued natural functional and evolutionary roles",NA,1,NA
NA,"care, mental health, cultural security, life-satisfaction",NA,1,NA
NA,diversity and economic value of bioinspired production,NA,1,NA
NA,areas including all uoa where people mainly rely on nature for their well being,NA,1,NA
NA,recognition of ilpcs lifestyles in close interaction with nature and their access to their lands and resources,NA,1,NA
NA,human mobility to access different natural habitats for outdoor recreation,NA,1,NA
NA,indirect access to natural products from natural habitats,NA,1,NA
NA,creation of new rural urban network,NA,1,NA
NA,visitation rates of parks,NA,1,NA
NA,people in proximity to parks or natural areas,NA,1,NA
NA,indigenous lands,NA,1,NA
NA,green space in cities,NA,1,NA
NA,area of natural and traditional landscapes and seascapes,NA,1,NA
NA,"number of protected areas, parks and gardens",NA,1,NA
NA,"visitation rate to natural terrestrial, coastal and marine areas",NA,1,NA
NA,"increased awareness, care, mental health, cultural security, life-satisfaction",NA,1,NA
NA,NA,NA,1,NA
NA,abundance of slowly changing ecosystems (time past last land use change),NA,1,NA
NA,identity value,NA,1,NA
NA,happyness,NA,1,NA
NA,quantitative genetic variation,NA,1,NA
NA,phenotypic variation,NA,1,NA
NA,neutral variation (markers not linked to traits under selection),NA,1,NA
NA,non-neutral variation (markers linked to traits under selection),NA,1,NA
NA,phylogenetic variation (of genes or populations within species),NA,1,NA
NA,demographic variation,NA,1,NA
NA,"functional diversity (fd), rarity, redundancy, vulnerability",NA,1,NA
NA,community-weighted mean trait value (cwm),NA,1,NA
NA,phylogenetic diversity (pd),NA,1,NA
NA,overdisperion/ underdispersion,NA,1,NA
NA,taxonomic diversity and distinctness,NA,1,NA
NA,"phylogenetic species richness (psr), clustering (psc), evenness (pse), variability (psv)",NA,1,NA
NA,number of species,NA,1,NA
NA,equitability (commonness and rareness),NA,1,NA
NA,species abundance distribution,NA,1,NA
NA,endemism (% endemics in community),NA,1,NA
NA,emergence (shannon’s information),NA,1,NA
NA,genetic variation (self-organization),NA,1,NA
NA,genetic variation (complexity),NA,1,NA
NA,genetic variation (homeostasis),NA,1,NA
NA,genetic variation (hamming distance),NA,1,NA
NA,genetic variation (dissimilarity),NA,1,NA
NA,genetic variation (cohesion),NA,1,NA
NA,"genetic variation (connectance, numbers of links by the number of nodes)",NA,1,NA
NA,betadiversity (species turnover),NA,1,NA
NA,gamma diversity (total diversity of species in a landscape),NA,1,NA
NA,genetic variation (nestedness),NA,1,NA
NA,phylogenetic betadiversity,NA,1,NA
NA,phylogenetic structure of a community,NA,1,NA
NA,trait convergence assembly pattern (tcap),NA,1,NA
NA,trait divergence assembly pattern (tdap),NA,1,NA
NA,functional betadiversity,NA,1,NA
NA,loss of species,NA,1,NA
NA,loss of phylogenetic diversity,NA,1,NA
NA,biodiversity barometer (% of respondents that have heard of biodiversity),NA,1,NA
NA,biodiversity barometer (% of respondents giving correct definition of biodiversity),NA,1,NA
NA,funding towards environmental education,NA,1,NA
NA,online interest in biodiversity (proportion of google searches),NA,1,NA
NA,funding towards environmental impact assessment,NA,1,NA
NA,number of research studies involving economic valuation,NA,1,NA
NA,world trade organisation greenbox agricultural subsidies,NA,1,NA
NA,funding towards institutional capacity building in fisheries,NA,1,NA
NA,percentage of countries that are category 1 cites parties,NA,1,NA
NA,ecological footprint,NA,1,NA
NA,red list index (internationally traded species),NA,1,NA
