indicator_harmonized,indic_ids,ipbes_sup
red list index (impacts of invasive alien species),IPBES_GA3_sup_34,1
red list index (impacts of pollution),IPBES_GA3_sup_30,1
red list index (internationally traded birds),IPBES_GA2.2_sup_61,1
red list index (internationally traded species),IPBES_GA3_sup_12,1
red list index (pollinators),IPBES_GA2.2_sup_62;IPBES_GA3_sup_57,1
red list index (wild relatives of farmed and domesticated species),IPBES_GA2.2_sup_64;IPBES_GA3_sup_54,1
refugee population,IPBES_GA2.1_sup_25,1
remaining primary vegetation,IPBES_GA2.2_sup_19,1
remaining primary vegetation (hotspots),IPBES_GA2.2_sup_20,1
remaining primary vegetation (indigenous lands),IPBES_GA2.2_sup_21,1
renewable electricity consumption (percentage of total electricity output),IPBES_GA2.1_sup_13,1
renewable energy share in the total final energy consumption,IPBES_SUA_sup_7.2.1_40,1
renewable internal freshwater resource,IPBES_GA2.1_sup_57,1
research and development expenditure as a proportion of gross domestic product,IPBES_SUA_sup_9.5.1_66,1
revenue generated and finance mobilized from biodiversity relevant economic instruments,IPBES_SUA_sup_15.a.1.b_134;IPBES_SUA_sup_15.b.1.b_136,1
seagrass meadow area,IPBES_GA2.2_sup_22,1
"share of women among owners or rights-bearers of agricultural land, by type of tenure",IPBES_SUA_sup_5.a.1.b_27,1
soil organic carbon,IPBES_GA2.2_sup_23;IPBES_GA2.2_sup_24,1
species habitat index,IPBES_GA2.2_sup_68,1
species occurrence records accessible through the global biodiversity information facility,IPBES_GA3_sup_64,1
species richness per grid cell,IPBES_GA2.2_sup_53,1
species status index,IPBES_GA3_sup_61,1
statistical capacity indicator for sustainable development goal monitoring,IPBES_SUA_sup_17.18.1_154,1
"sustainable fisheries as a proportion of gross domestic product in small island developing states, least developed countries and all countries",IPBES_SUA_sup_14.7.1_117,1
terrestrial c sequestration,IPBES_GA2.2_sup_34,1
terrestrial net primary production,IPBES_GA2.2_sup_35;IPBES_GA2.2_sup_36,1
"total amount of funding for developing countries to promote the development, transfer, dissemination and diffusion of environmentally sound technologies",IPBES_SUA_sup_17.7.1_144,1
"total government revenue as a proportion of gross domestic product, by source",IPBES_SUA_sup_17.1.1_138,1
total greenhouse gas emissions per year,IPBES_SUA_sup_13.2.2_106,1
total official development assistance grants from all donors that focus on poverty reduction as a share of the recipient country’s gross national income,IPBES_SUA_sup_1.a.1_10,1
total official flows (official development assistance plus other official flows) to the agriculture sector,IPBES_SUA_sup_2.a.2_23,1
total official international support (official development assistance plus other official flows) to infrastructure,IPBES_SUA_sup_9.a.1_67,1
"total per capita expenditure on the preservation, protection and conservation of all cultural and natural heritage, by source of funding (public, private), type of heritage (cultural, natural) and level of government (national, regional, and local/municipal)",IPBES_SUA_sup_11.4.1_80,1
"total resource flows for development, by recipient and donor countries and type of flow (e.g. official development assistance, foreign direct investment and other flows)",IPBES_SUA_sup_10.b.1_78,1
tourism direct gross domestic product as a proportion of total gross domestic product and in growth rate,IPBES_SUA_sup_8.9.1_55,1
tree cover,IPBES_GA2.2_sup_25;IPBES_GA3_sup_16,1
"unemployment rate, by sex, age and persons with disabilities",IPBES_SUA_sup_8.5.2_50,1
united nations framework convention on climate change,IPBES_GA2.1_sup_61,1
urban population,IPBES_GA2.1_sup_23,1
vegetation biomass,IPBES_GA2.2_sup_26,1
volume of production per labour unit by classes of farming/pastoral/forestry enterprise size,IPBES_SUA_sup_2.3.1_17,1
volume of remittances (in united states dollars) as a proportion of total gross domestic product,IPBES_SUA_sup_17.3.2_142,1
water withdrawal,IPBES_GA2.1_sup_56,1
"weighted average tariffs faced by developing countries, least developed countries and small island developing states",IPBES_SUA_sup_17.12.1_149,1
wetland extent trends index,IPBES_GA2.2_sup_27;IPBES_GA3_sup_15,1
wild bird index (farmland birds),IPBES_GA3_sup_26,1
wild bird index (habitat specialists),IPBES_GA2.2_sup_76;IPBES_GA3_sup_18,1
wild mammal biomass,IPBES_GA2.2_sup_77,1
world trade organisation greenbox agricultural subsidies,IPBES_GA3_sup_7,1
worldwide weighted tariff-average,IPBES_SUA_sup_17.10.1_147,1
